title,description,price,images,category,handle,variants
EELHOE Shower Steamers Tablets Stress Relief Cleansing of Skin Brightening Relaxation Treatment Body Cleaning Self Care Products,EELHOE Shower Steamers Tablets Stress Relief Cleansing of Skin Brightening Relaxation Treatment Body Cleaning Self Care Products Specifications: ●Condition: 100% brand new and high quality ●Item Type: Deep cleaning Shower Steamers Tablets ●Content: 6 packs ●Shelf life: 3 years ●Storage method: Store in a cool dry place Features: 🌿 Soothing Aromatherapy Experience Helps promote deep breathing and complete relaxation Creates a calming effect for both body and mind 🌱 Gentle & Safe Formula Made with 100% natural ingredients Non-irritating and hypoallergenic 🔥 Therapeutic Benefits Helps dispel body chill and improve warmth Boosts metabolism and blood circulation Effectively relieves stress and tension ✨ Convenient Design Individually wrapped for hygiene Easy to use and carry anywhere Discreet and comfortable to wear 🧴 Universal Compatibility Suitable for all skin types including: • Dry skin • Oily skin • Combination skin • Sensitive skin • Mature skin How to use: 1. Tear open the outer packaging. 2. Place the product on the shower floor or hang it on the bathroom wall to fully release the fragrance. Notice: * Please store in a cool place to avoid high temperature and direct sunlight. * Please keep this product out of the reach of children. * Actual color may be slightly different from the image due to different monitor and light effect. * Please allow 1-3cm deviation due to manual measurement. Self Care Relaxing Shower Steamers Tablets,65.0,https://cdn.shopify.com/s/files/1/0914/7816/3826/files/a8cfe9114db14a8fa369023de751f4ef.webp?v=1748113539,Bath & Body,eelhoe-shower-steamers-tablets-stress-relief-cleansing-of-skin-brightening-relaxation-treatment-body-cleaning-self-care-products,Buy 3 for 2 Free
"4cm X 150cm Silicone Scar Sheets , 1 Roll Self-Adhesive Scar Cover Tape Skin Care Waterproof and Breathable","4cmX150cm Silicone Scar Sheets , 1 Roll Self-Adhesive Scar Cover Tape Skin Care Waterproof and Breathable",16.0,https://cdn.shopify.com/s/files/1/0914/7816/3826/files/db5477b2a63e4dbab5688cbe7ccf579d.webp?v=1748113538,Skin Care,4cm-x-150cm-silicone-scar-sheets-1-roll-self-adhesive-scar-cover-tape-skin-care-waterproof-and-breathable,ELAIMEI brand
Adjustable Waist Self-heating belt protector Back Waist Support Belt Lumbar Brace Massage Band Health Care,"Features: 1.Spontaneous heating 2.Relieve lower back pain by reducing pressure. 3.Neoprene back panel for warmth and compression. 4.Vented and breathable elastic side panels. 5.Adjustable and comfortable. 6.Professionally designed Double Pull braces can be adjusted. Specifications: 100% Brand New And High Quality Material:Magnetic composite cloth heating cloth Color: as picture Size:S: Length 100cm, width 14cm M: Length 105cm, width 14cm L: Length 110cm, width 14cm XL: Length 115cm, width 14cm Conversion:1inch=2.54cm,  1cm=0.394inches Warm Tip : 1.Please be reminded that due lighting effects, monitor's brightness/contrast settings etc, there could be some slight differences in the colour tone of the website's photo and the actual item. 2.Item Measure by hand, it could be 1cm different,your kind understanding will be much appreciated. Package Content: 1* Waist Support Belt",16.0,https://cdn.shopify.com/s/files/1/0914/7816/3826/files/0773f7de64d64a32ab07764d0e47436c.webp?v=1748113535,Wellness,adjustable-waist-self-heating-belt-protector-back-waist-support-belt-lumbar-brace-massage-band-health-care,Black
Hair Steamer Cap Electric Hair Heating Cap Thermal Treatment Hat Waterproof Self-heating Hat SPA Nourishing Hair Styling Care,"Features 1. Waterproof inner embedded plastic film can maintain better moisture keeping effect and steaming performance to improve hair split ends and repair hair damage, effortlessly helping regain your silky smooth hair. 2. Two adjustable heating stages are available for options, max up to 75 degrees, which can provide custom thermal treatment for your hair to effectively avoid unnecessary over-heat damage and reduce hair frizz and static. 3. One button control design, you can easily slide the button to power on/off and switch the temperature modes, user friendly and convenient. 4. Enhanced insulation material and overheat protection function can offer the maximum comfort and safety for you. 5. Quick-to-release drawstring can freely adjust the cap closure to secure fit your head with perfect tightness. 6. Detachable and smooth zipper design allows for cleaning convenience and maintain breeze, suitable for both home and travel use, you can instantly access hair nursing whenever and wherever you want, resulting in shinier, healthier and stronger hairfinally. Specifications Material: Waterproof Cloth, Plastic Color: Pink Plug Type: US Plug/EU Plug(Optional) Voltage: 220V Power: 50W Heat Stages: High - Low - Off Heating Temperature: Max. Up to 60℃ LED Indicator: Yes Size: As Picture Shown Package Included: 1* Hair Steamer Cap with Power Cord",16.0,https://cdn.shopify.com/s/files/1/0914/7816/3826/files/95ce59a79a3f4ce8b4b1f6652ee2e372.webp?v=1748113532,Bath & Body,hair-steamer-cap-electric-hair-heating-cap-thermal-treatment-hat-waterproof-self-heating-hat-spa-nourishing-hair-styling-care,Red-EU
Adjustable Waist Tourmaline Self heating Magnetic Therapy Back Waist Support Belt Lumbar Brace Massage Band Health Care,"Features: 1. High elastic fiber cloth, fine texture, soft handle. 2. Vented and breathable elastic side panels. 3. Adjustable Neoprene double pull braces. 4. Nano infrared thermal acupuncture dot matrix, heating quickly, lasting effect. 5. Magnetic therapy increase blood flow and help relieve pain associated with joint and back problems. 6. Magnetic heating effect helping to relax muscles and reduces fatigue. 7. Supporting the waist, maintain a good posture so that have some effects on lose fat and keep slim in some way. Suitable for: 1. People who has health problem like protrusion of lumbar vertebral disc, sciatica and / or lumbar hyperosteogeny. 2. People whose waist need keeping warm. (Recommend worn it under thin garment) 3. People who always work sedentarily or in a prolonged standing position such as drivers or office workers. 4. Athletes or people doing regular exercise. Usage: 1. Wipe the tourmaline function fabric with wet cloth to get a better effect. 2. Put the tourmaline function fabric close to the body, fixed on the location that needs physical therapy. 3. Appropriately adjust elasticity (Please according to your skin feel decided to wear the length of time.)",21.0,https://cdn.shopify.com/s/files/1/0914/7816/3826/files/c45682081802457ab1f954d2be6f1854.webp?v=1748113529,Wellness,adjustable-waist-tourmaline-self-heating-magnetic-therapy-back-waist-support-belt-lumbar-brace-massage-band-health-care,black
5Pcs Car Polishing Pad Kit 5/6/7 Inch Self-Adhesive Buffing Wheel Car Detailing Waxing Sponge Pads Auto Care Cleaning Tool,"Features: It is used to wax, polish and seal glazes of various coatings to clean and improve their brightness. Used in combination with polishing liquid (paste, powder) to combine with the surface to be polished for better polishing. It can be washed and cleaned, used repeatedly, saving cost, environmental health. It can be used for manual waxing or for use with motors. A variety of sizes are available, and the styles are complete to meet the needs of consumers. Rich in color, beautiful in appearance, cool in style and unique in style, it adds fun to the work. High-quality materials, comfortable, durable, easy to use, no need to install, get started quickly. Specifications: Material: Polyester Sponge Color: blue/yellow/white/black/orange Size: 5/6/7inch Quantity: 5pcs Package Including: 5pcs* Polishing Pad Note: 1. Due to the different monitor and light effect, the actual color of the item might be slightly different from the color showed on the pictures. Thank you! 2.Please allow 1-2cm measuring deviation due to manual measurement.",14.0,https://cdn.shopify.com/s/files/1/0914/7816/3826/files/6e84c91346f248d29491899fc80af67f.webp?v=1748113525,Other,5pcs-car-polishing-pad-kit-5-6-7-inch-self-adhesive-buffing-wheel-car-detailing-waxing-sponge-pads-auto-care-cleaning-tool,5 Inch
1PC Tourmaline Self-Heating Magnetic Therapy Neck Brace Support Belt Cervical Vertebra Protection Spontaneous Heating Massager,"1PC Tourmaline Self-Heating Magnetic Therapy Neck Brace Support Belt Cervical Vertebra Protection Spontaneous Heating Massager Usage: 1. Thoroughly wipe the tourmaline on the brace with a damp cloth. 2. Place the tourmaline on the brace close to the neck and fix it in place. 3. Adjust the tightness properly, keep the pad touching on skin. generally 15-30 minutes, you can feel warm. 4. If the rednesss occurs in the corresponding parts, it is a nomal phenomenon. After 20 mins of removal, the phenomenon will disappear. Specification: Name: Self-heating Magnetic Neck Belt Color: Black Size: 47.5*9cm Features: 1. Permanent Magnet: self-heating when meet with water 2. High-elastic Fabric: flexible and comfrotable 3. Magic Velcro Function: 1. Strenthen neck care 2. Dredge the meridians 3. Promote blood circulation 4. Eliminate work stress 5. Promote sleep 6. Relieve fatigue Package Included: 1x Self-heating Neck Belt",12.0,https://cdn.shopify.com/s/files/1/0914/7816/3826/files/6cbf356b356445dc85911d83af4a0208.webp?v=1748113523,Wellness,1pc-tourmaline-self-heating-magnetic-therapy-neck-brace-support-belt-cervical-vertebra-protection-spontaneous-heating-massager,Variant
"Wood Back Massage Roller Rope, Wood Therapy Cellulite Massage Tools, Self Massage Tools for Neck Leg Back Pain Relief Body Care","【Natural Wood Portable Personal Massage Roller Rope】: The roller rope massage tool is made from high-quality 100% natural wood which will withstand the rigors of heavy use while remaining corrosion free. The high-end quality of this product is recognized, used and recommended by professionals.The edges are smooth and will not scratch the skin,which can effectively massage the body. 【Massage Stimulates And Relaxes The Body】: The roller on the pressure points of your lower back, upper back, middle back, neck, shoulders, feet, arms and other parts of the body to reduce stress and anxiety, improve blood circulation, relieve back pain and relax the body. 【Hand-Held】: The massage roller ball is installed on the rope. This easy-to-operate massage device can smoothly slide between the head, neck, shoulders, back, feet and other parts of the body. The user can adjust the massage strength according to his own situation. 【Product Highlights】: In order to solve the inconvenient of self-massage in the neck, shoulder, back and waist,massage rope offers 12 accurately placed therapy rollers that allow you an ease and access to every pressure point in your entire body.Effortlessly locate and relieve spasms, muscle knots and trigger points,Increases blood flow and circulation.Helping your full body parts to release stress. 【Compact & Lightweight】: The massage roller is small and convenient, easy to place and take, suitable for carrying around, very suitable for family and travel, Can also be brought to the gym in a fitness bag. Forcare",39.0,https://cdn.shopify.com/s/files/1/0914/7816/3826/files/9d913386cd5b42df8f14831e11f06aff.webp?v=1748113520,Health Accessories,wood-back-massage-roller-rope-wood-therapy-cellulite-massage-tools-self-massage-tools-for-neck-leg-back-pain-relief-body-care,1
Silicone Forefoot Pads for Women High Heels Half Insoles Anti-slip GEL Self-adhesive Shoe Pad Foot Pain Care Inserts Cushion,"Silicone Forefoot Pads for Women High Heels Half Insoles Anti-slip GEL Self-adhesive Shoe Pad Foot Pain Care Inserts Cushion Welcome to our shop Dear friends : When you place an order, please note the following points! Type: Silicone Forefoot Pads Material:Silicone Color:Clear Package include:1pair Transport: Sent within 24 hours ,",14.0,https://cdn.shopify.com/s/files/1/0914/7816/3826/files/a254365cd27f4cf6aeb0590e36d9c951.webp?v=1748113518,Skin Care,silicone-forefoot-pads-for-women-high-heels-half-insoles-anti-slip-gel-self-adhesive-shoe-pad-foot-pain-care-inserts-cushion,Clear
Retractable Stainless Steel Claw Massager For Back Massage Promotion Tools Blood Circulation Relax Health Back Scratcher Tool,Retractable Stainless Steel Claw Massager For Back Massage Promotion Tools Blood Circulation Relax Health Back Scratcher Tool,14.0,https://cdn.shopify.com/s/files/1/0914/7816/3826/files/7b6eb5e069f54086acf4155303e28ad5.webp?v=1748113514,Other,retractable-stainless-steel-claw-massager-for-back-massage-promotion-tools-blood-circulation-relax-health-back-scratcher-tool,Black
"Smart Body Fat Scale, High-Precision Digital Bathroom Weight Scale for Home Use, Fitness Health Monitor Elegant Gift","Smart Body Fat Scale - High-Precision Digital Bathroom Weight Scale for Home Use, Fitness Health Monitor - Elegant Gift Upgrade your health journey with our Smart Body Fat Scale, a high-precision digital bathroom weight scale designed for home use.  Its sleek, modern design makes it a perfect addition to any bathroom, while its user-friendly app sync via Bluetooth ensures seamless tracking on your smartphone. Whether you're a fitness enthusiast or looking for a thoughtful elegant gift, this scale is a must-have. Enjoy fast shipping, reliable performance, and durable construction – shop now and take the first step towards a healthier lifestyle!",38.0,https://cdn.shopify.com/s/files/1/0914/7816/3826/files/2be679cdecfc4a24b23d119507b6dcaf.webp?v=1748113510,Bath & Body,smart-body-fat-scale-high-precision-digital-bathroom-weight-scale-for-home-use-fitness-health-monitor-elegant-gift,White-Battery
12×Replacement Brush Heads For Oral-B Electric Toothbrush Fit Advance Power/Pro Health/Triumph/3D Excel/Vitality Precision Clean,"Package included: 4-16pcs(optional)(4pcs in one pack) Feature: Replacement Tooth Brush Heads Fit for: Professional Care: 500, 550, 1000, 3000, 2000, 600 , 1000 ,3250, 5000, 5500, 6000, 6500, 7400, 7500, 7550, 7850, 7875, 8000, 8300, 8500, 8850, 8860, 8875, 8900, 8950, 3D Excel, Plak Control 3D Triumph Professional Care: 9000, 9100, 9400, 9425, 9450, 9475, 9500, 9900, 9910, 9930, 9950 Trizone: 600,1000,3000,5000 Triumph: 5000 wireless SmartGuide, 4000, Triumph 5000 inkl. Smart Guide Smart Series: 4000, 4750, 5000, SmartSeries 4000 , SmartSeries 5000 with SmartGuide, Oral B Vitality Precision Clean Oral B Sensitive Clean Oral B White Clean Advance Power: 400, 450, 450TX, 800, 850, 900, 950, 950TX, Plak Control: Duo, Travel, Duo Interclean: IC2522, ID2021, ID2025, ID2025T Pro Health: Precision Clean, Dual Clean Vitality: Precision Clean, Dual Clean, Trizone, Sensitive, Floss Action , Pro white Pro-Health Precision Clean All our products are brand new and manufacturer sealed. Not made by Oral B. These brush heads are not compatible with Oral B Vitality Sonic, Oral B CrossAction Power, Oral B Sonic Complete or Oral B Pulsonic , PRO 1000 How to use: Just simply replace brush heads as usual. Bristles Of Toothbrush Has Never Been Touched Or Used",13.0,https://cdn.shopify.com/s/files/1/0914/7816/3826/files/d48b2f133afb45448335b28540d5b822.webp?v=1748113508,Other,12xreplacement-brush-heads-for-oral-b-electric-toothbrush-fit-advance-power-pro-health-triumph-3d-excel-vitality-precision-clean,8 Pcs
1 Piece Nasal Wash Bottle 300ml Adult And Children Nasal Cavity And Nasal Wash Bottle Physiological Saline Rhinitis Manual,"• Large Capacity : With a capacity of 300ml, this nasal wash bottle is perfect for adults and children alike. • Physiological Saline : The physiological saline solution in this nasal wash bottle helps to clean and moisturize the nasal cavity. • Manual Operation : This nasal wash bottle is designed for manual operation, making it easy to use and control the flow of solution. • Personal Health Care Accessory : As a personal health care accessory, this nasal wash bottle is an essential tool for maintaining a healthy nasal cavity. Relieve discomfort. - Nasal cleaning bottles help relieve symptoms of common nasal irritation such as hay fever, smoke, rhinitis, sneezing, urban pollution, etc. Nose cleaning bottles gently remove dirt, dust and other contaminants. Suitable for every nose size, suitable for adult or child use, clean and moisturize nose. Care for your nasal passages - Your nose is your body's air filter and first line of defense against airborne particulates, and experts recommend regular nasal care. 1 Piece 300ml Adult And Children Domestic Nasal Wash Bottle Nasal Cavity And Nasal Wash Bottle. Precautions: 1. Due to manual measurement, please allow a difference of 1-3mm. Thank you for your understanding! 2. Due to the differences between different monitors, please understand that the image may not reflect the true color of the article.",14.0,https://cdn.shopify.com/s/files/1/0914/7816/3826/files/2a9cc9e0a42d49a4aab6c10ac7868cc4.webp?v=1748113505,Other,1-piece-nasal-wash-bottle-300ml-adult-and-children-nasal-cavity-and-nasal-wash-bottle-physiological-saline-rhinitis-manual,Variant
Chin Cheek Slimming Bandage V Shaper V Line Lifting Mask Face Lifting Anti Wrinkle Strap Band Sleeping Mask Beauty Health,"Description: SPECIFICATION: Color: pink Packaging: opp Scope of application: 1. Suitable for daily facial molding, shaping the contours of the cheeks 2. Lift both chin, lift facial droop, optimize masseter muscle lines, make it lighter and thinner without curling edges, and prevent stuffiness when worn for a long time. 3. Suitable for physical shaping care after facial. Usage suggestions: Please adapt from half an hour for the first time. After adaptation, you can adapt for 1-8 hours per day according to your personal situation. Reduce usage time if you feel unwell After forming a regular pattern, adhere to using it for 1-2 months, and the effect is obvious Reminder: 1. For long-term use, it is recommended to purchase more than 2 sets of alternating washing to extend the service life of the product. 2. For oily skin and those prone to sweating, clean the face before and after wearing, and wash the mask frequently to keep cleaning. 3. The effect is better when combined with massage techniques, facial exercises, and beauty instruments. Maintenance and cleaning: 1. It is recommended to change and wash the mask once every 2-3 days, as frequent washing can shorten the service life of the mask 2. Wash with warm water and neutral detergent below 40 degrees Celsius to avoid prolonged immersion. Do not machine wash and dry to maintain fabric elasticity 3. Before drying, use a towel to fully absorb the water and do not twist it forcefully. Smooth it and hang it up. Dry it in a ventilated place in the shade. It can be placed indoors or under the eaves to avoid direct sunlight and ironing COMMENT: 1. Manual measurement tolerance is 2-5g. Please don't mind your substitutions. 2. Due to the difference between different monitors, the image may not reflect the actual color of the item. thank you very much! 3. SKU color is the color of product packaging PACKAGE INCLUDED: 1*Beauty Face Sculpting Sleep Mask Thank you for your attention, We guarantee the quality of our products.If you need more this item ,you can contact us.we will give you our best price. Leave your message!",11.0,https://cdn.shopify.com/s/files/1/0914/7816/3826/files/502c450d02f8462c85365694448af5ad.webp?v=1748113503,Face Care,chin-cheek-slimming-bandage-v-shaper-v-line-lifting-mask-face-lifting-anti-wrinkle-strap-band-sleeping-mask-beauty-health,Pink
Dog Collar Nylon LED Night Safety Flashing Glow In The Dark Pet Dog Leash pet Dogs Luminous Fluorescent  dog accessories collar,Dog Collar Nylon LED Night Safety Flashing Glow In The Dark Pet Dog Leash pet Dogs Luminous Fluorescent  dog accessories collar,13.0,https://cdn.shopify.com/s/files/1/0914/7816/3826/files/1615638aec5b43f395651192ddc7cc74.webp?v=1748113491,Other,dog-collar-nylon-led-night-safety-flashing-glow-in-the-dark-pet-dog-leash-pet-dogs-luminous-fluorescent-dog-accessories-collar,RED
Durable Tactical Dog Collar and Leash Adjustable Military Pet Collar Leash Medium Large Dog German Shepherd Training Accessories,"Durable Tactical Dog Collar and Leash Adjustable Military Pet Collar Leash Medium Large Dog German Shepherd Training Accessories Please note: The collar and leash are ordered separately!They are not sold as a set!Buyers can choose to order according to their needs! About this product 【Premium Material】--The tactical dog collar is made of 1000D reinforced nylon fabric and sturdy metal buckle, which is very durable and wear-resistant, highly recommended by fans of military and police gear. 【Soft and Comfortable】--Adjustable dog collar, quick release, designed with soft and breathable padded lining, suitable for collar, humanized design. 1.5 inches (about 3.8 cm) wide rounded corners, comfortable to wear, will not hurt the dog's fur, and can protect the dog's neck well. 【Practical Design】--The military dog collar has a special control handle, which can help you control your dog well, ideal for medium and large dogs, especially for dog training, patrolling, walking and hunting. 【Double Security】--One-piece collar button design for military training dog collar, one button to unlock, easy to put on and take off, metal buckle is adjustable, you can change the length of the collar according to your dog's neck circumference, magic stickers and metal The buckle provides double security for your dog and does not easily fall off Product Analysis [Every detail of craftsmanship is very important]] About size 3 sizes 7 colors available. Please follow the size chart (refer to the picture of the size) to measure your dog carefully before you place the order to ensure the collar is fit well to your dog. M code: 38-47CM L code: 45-55CM XL code: 53-63CM Towing rope size: The traction rope is one size, the natural length is 106cm, and the longest stretched length is 140cm Triple reinforcement protection More details More details 360° surround protection • All-round neck care -Intimate rounded corner design does not wear neck High quality zinc alloy fasteners, strong and durable, easy to wear. Velcro 02 Multiple Velcro designs, and the extra parts can be pasted with Velcro. Adjustable size You can fine-tune dogs of different dog types and sizes. Pure cotton breathable lining 04 outer nylon material, soft colton inside, breathable and moisture absorbing, more comfortable for dogs to wear. 05:High quality zinc alloy traction buckle High hardness without deformation, more durable after stain proofing. 【Wholesale direct shipping】 We support drop shipping and wholesale, for wholesale please feel free to contact us for the best price. For drop shipping, we can send the goods directly to your customer without leaving information about us if you wish. How do I track my package? You can use your tracking number to track your package at: www.17track.net/en (copy to browser to open) About Feedback - Upon receipt of the item, your confirmation will be greatly appreciated. Hope you can give us a positive feedback (4 or 5 stars) once you receive the product. - Before you leave negative feedback. Please contact us first, we can help you solve the problem. · We strive to do better and make you satisfied! About delivery 1. If you choose to ship from China, we will ship by AliExpress standard; if you choose to ship from overseas warehouse, we will ship by local logistics. 2. Your order will generally be shipped within 24 hours, please be patient. 3. Please feel free to let me know if you have any questions, we will solve it for you as soon as possible. About the service 1. If you have any questions, please feel free to contact us. We will reply within 24 hours, except weekends. 2. If you encounter any problems, don't worry. You can contact us first. We promise that we will do everything possible to help you. 3. Please be aware of the time difference between us. We work in China. Dog leash,pet,dog accessories ,Leash, Medium dog harness,Harness for dog, dog training, retractable dog leash, collar for large dogs, Tactical vest ,Harness for training, german shepherd,Training Hunting,Durable Tactical Dog Collar,Dog leash,pet,dog accessories ,Leash, Medium dog harness,Harness for dog, dog training, retractable dog leash, collar for large dogs, Tactical vest ,Harness for training, german shepherd,Training Hunting,Durable Tactical Dog Collar",15.0,https://cdn.shopify.com/s/files/1/0914/7816/3826/files/a95e981feca1437e9bf5c241d9496466.webp?v=1748113483,Other,durable-tactical-dog-collar-and-leash-adjustable-military-pet-collar-leash-medium-large-dog-german-shepherd-training-accessories,Green Leash
Adjustable Collar Harness Dog Leash Nylon Pet Lead Leash Dog Harness Durable Rope Belt Lightweight Dog Accessories Cat Collar,"Adjustable Collar Harness Dog Leash Nylon Pet Lead Leash Dog Harness Durable Rope Belt Lightweight Dog Accessories Cat Collar This P chain is relatively soft and not easy to catch hair. Dogs are more comfortable to wear. The connecting part is made of leather and is hand-stitched! In addition, a metal ring to control the tightness is added inside the P ring, which is very important! ! For disobedient dogs, you can put the metal ring small, but not too small so as not to hurt the dog's neck. Or a puppy who is using it for the first time or who is not sensible can relax a bit. Does not cause discomfort to the dog. .",15.0,https://cdn.shopify.com/s/files/1/0914/7816/3826/files/3a8449e8216d4664a040c78095cd5016.webp?v=1748113470,Wellness,adjustable-collar-harness-dog-leash-nylon-pet-lead-leash-dog-harness-durable-rope-belt-lightweight-dog-accessories-cat-collar,Khaki  1.8m
