title,description,price,images,category,handle,variants
Original Pro6 TWS Wireless Bluetooth Headset Bluetooth 5.3 Earphones Sport Earbuds Smart Touch Music Headset For All Smartphones,,18.0,https://cdn.shopify.com/s/files/1/0914/7816/3826/files/ef7b89b1350f45258b7463e05fe465f8.webp?v=1748113154,Other,original-pro6-tws-wireless-bluetooth-headset-bluetooth-5-3-earphones-sport-earbuds-smart-touch-music-headset-for-all-smartphones,black
A2Pro TWS True Wireless Bluetooth Macaron Headphones V5.3 Ultra-long Battery Life and Stereo Low-latency Gaming Sports Headset,"• Ultra-long battery life : Enjoy uninterrupted music for hours with the headphones' ultra-long battery life. • Low-latency gaming and sports headset : Experience smooth and seamless audio during intense gaming sessions or while working out with the low-latency feature. • True wireless communication : Enjoy the freedom of movement with true wireless communication, allowing you to roam freely without any wires getting in the way. • Neodymium magnet type : The neodymium magnet type ensures a secure fit and prevents the earbuds from falling out during physical activities. Description: 1. Bluetooth pairing name: A2 / TWS 2. Bluetooth version: V5.3EDR 3. Battery capacity of charging bin: 250mAh 4. Headphone battery capacity: 30mAh 5. Charging time: 30min(headset)/110min(with chargingcase) 6. Duration: 25hours in total(Cooperate with the charging case) 7. Output power of charging chamber: 5V/100mA 8. Talk time: 4H 9. Working distance: 10-20m (barrier-free straight line) 10. Charging interface: Type-C Specifications: 1. Take out the headphones and pair them automatically. 2. 3D stereo sound. 3.Comfortable to wear 4. Low latency Notes: 1. Please read the title book carefully before use and follow the instructions to guide the operation. 2. Due to long-term transportation, the headphone battery may be depleted. After receiving the goods, please charge the headphones for half an hour before using them. Thank you for your cooperation! Package Included: 2 * earphone, 1 * charging sharing, 1 * data cable, 1 * manual instruction",13.0,https://cdn.shopify.com/s/files/1/0914/7816/3826/files/991b891ecf7f47a6aeeae6f446290d25.webp?v=1748113151,Other,a2pro-tws-true-wireless-bluetooth-macaron-headphones-v5-3-ultra-long-battery-life-and-stereo-low-latency-gaming-sports-headset,khaki
E7s Tws Gaming Headset Bluetooth Earphones Earbuds Blutooth Earphone Wireless Hearing Aids Sport EarBuds Hifi headphones,"E7S Product Paramater: ● Call duration: about 4 hours ● Bluetooth version: 5.0 ● Working distance: about 10M ● Music time: 3.5 hours ● Headphone battery capacity 450MAH ● Charging compartment battery capacity: 2200MAH ● Waterproof level: IPX5 ● Music playback time: about 4 hours ● Standby time: about 80 hours ● Without Packaging Box ● NOTE: -- When using for the first time, please put the earphones into the earphone case to charge(use 5V/2A USB Cable) -- When using for the first time, please pair the connection -- When making calls, only one earbud works -- The sound is intermittent, the reasons are: ①The distance from the connected device is more than 10M. ②The partition wall. ③Nearby interfering signal connections.",18.0,https://cdn.shopify.com/s/files/1/0914/7816/3826/files/5947246149a0467889a7b599e749a924.webp?v=1748113148,Other,e7s-tws-gaming-headset-bluetooth-earphones-earbuds-blutooth-earphone-wireless-hearing-aids-sport-earbuds-hifi-headphones,Yellow
Toocki Air Conduction Earhook Wearing Headphones Bluetooth 5.3 Earphones with Mic Gaming Sports Hi-Fi Stereo Headset for Phones,Product Parameters Brand： Toocki Name: Air Conduction Bluetooth Earphones Material: ABS Earphone Capacity: 80mAh Rated Voltage: 3.7V Charging Time: About 1.2 hours Charging Port: Type-C Bluetooth Version: V5.3 Bluetooth Protocol: A2DP/AVDTP/AVRCP/RFOMM/HFP/HSP/SPP/HID Receiving Distance: About 10m Weight: About 12.5g Toocki Air Conduction Wireless Bluetooth Headset for Android iOS Earhook Wearing Hi-Fi Stereo Bluetooth 5.3 Headphones with Mic √ Black/Beige/Pink/Purple Multi-Color Earbuds/Fearless Sound Leakage Earphones √ Lightweight Design Bluetooth Headset/Innovative Earhook Wearing Headphones √ 3D Hi-Fi Stereo Sound Headphones for Xiaomi Huawei iPhone Redmi OPPO Honor Black Shark and more Phones,26.0,https://cdn.shopify.com/s/files/1/0914/7816/3826/files/68bc5750db6f472e83c3756c736afcac.webp?v=1748113144,Other,toocki-air-conduction-earhook-wearing-headphones-bluetooth-5-3-earphones-with-mic-gaming-sports-hi-fi-stereo-headset-for-phones,Beige 2Pack
New USB Cooling Fan Electronic Gadgets Ventilador Led Usb Mini ventilador Portable Flexible Cooler For Laptop Smart Phone,"New USB Cooling Fan Electronic Gadgets Ventilador Led Usb Mini ventilador Portable Flexible Cooler For Laptop Smart Phone Feature: Color: Pink,Blue,White,Orange,Black,Green (Real color could be a little bit different from stock photos due to screen reflection) Style: CASUAL Compatible with USB 1.0 and USB 2.0 Plug and play; no driver installation required Powered by USB port, low power consumption Package Include: 1 x Mini USB Fan",15.0,https://cdn.shopify.com/s/files/1/0914/7816/3826/files/0cbb36bb1c1241f3813dadac522df972.webp?v=1748113141,Other,new-usb-cooling-fan-electronic-gadgets-ventilador-led-usb-mini-ventilador-portable-flexible-cooler-for-laptop-smart-phone,Orange
BPR3S PLUS BT Air Mouse Voice Function IR learning TV 2.4G Wireless Remote Controller With Gyroscope for Android TV Box/PC,"BPR3S PLUS BT Air Mouse Voice Function IR learning TV 2.4G Wireless Remote Controller With Gyroscope for Android TV Box/PC Bluetooth Pairing 1. To pair another new device, press ""OK"" and ""Back"" at the same time till the light flashes. 2. Keep the remote control within 1 meter of the device for faster pairing. 3. Open Bluetooth searching, and pair with ""BPR3S"". IR Learning (All buttons) 1. Press the button that needs to learn for 8 seconds till the indicator light is always on after flashing, then release. 2. Align the IR, and press the button that would be learned, it shows success when the indicator light flashes. 3. Repeat 1~2 to learn the other buttons. 4. Press ""Delete"" and ""Back"" simultaneously until the light flashes to reset IR. 2.4G Pairing 1. Keep pressing the ""OK"" and ""Back"" at the same time till the light flashes. 2. Plug in the USB receiver and keep the remote near the USB receiver within 50 cm for faster pairing. 3. The indicator light stops flashing to indicate successful pairing. 4 TV Buttons IR Isolation 1. Four TV buttons default Samsung TV IR code values, 2. Four TV buttons IR isolation in Bluetooth mode 3. Four TV buttons support any IR values learning. Highlights 1. The button would be in IR mode when disconnected from Bluetooth. 2. If the buttons have completed IR learning, the power button will send the IR signal in priority in Bluetooth mode. 3. In IR mode, it supports full button learning, with no mouse function. 4. Press ""OK"" + ""volume +/-"" shortly to control the speed of the mouse. 5. In Bluetooth mode, the voice function is applicable to some ATV devices, like TCL Smart TV, Shield TV Box, HAKO mini, Google TV, etc. But the voice function may be incompatible with the other devices. 6. In Bluetooth mode, the voice function is incompatible with all AOSP Android functions and is not equipped with a USB receiver. 7. In 2.4G mode, the voice function supports AOSP Android and ATV devices. 8. In 2.4G mode, some ATV TVs cannot enter when logging into a Google account. 9. If the ""ok"" button is not compatible with the Google account login interface, please contact the seller. 10. If no infrared learning, all buttons are 2.4G or Bluetooth mode function accordingly. Feel free to tell us more about device compatibility issues and help us upgrade products. info@boxput.com",28.0,https://cdn.shopify.com/s/files/1/0914/7816/3826/files/2e212363c78545aa9d06e65f8501d0ff.webp?v=1748113138,Other,bpr3s-plus-bt-air-mouse-voice-function-ir-learning-tv-2-4g-wireless-remote-controller-with-gyroscope-for-android-tv-box-pc,BPR3S PLUS
TWS F9-5 Earphone Bluetooth 5.3 Wireless Headphones Hifi Stereo Sports Waterproof Earbuds Headset Hearing Aids With Mic Handfree,,18.0,https://cdn.shopify.com/s/files/1/0914/7816/3826/files/027ed8f796cc48aca58cf16031d4c9d8.webp?v=1748113135,Other,tws-f9-5-earphone-bluetooth-5-3-wireless-headphones-hifi-stereo-sports-waterproof-earbuds-headset-hearing-aids-with-mic-handfree,black
Bluetooth5.3 Voice Translator Earbud Wireless 144Language Translate Earphone Real Time Smart Travel Voice Translation Headphone,,49.0,https://cdn.shopify.com/s/files/1/0914/7816/3826/files/8c0f1ab7531645978919e3e2c352a954.webp?v=1748113133,Other,bluetooth5-3-voice-translator-earbud-wireless-144language-translate-earphone-real-time-smart-travel-voice-translation-headphone,white
Digital Auto Screen Clicker for Smart Phone Apps Video Live Streaming Gadget Smartphone Game Screen Touch Tripods Tapper,"100% Brand New and High Quality ! Name: Auto Screen Clicker Function: like fast, game cycle Color: black/pink Power Supply:Usb. Size: about 98.4 * 20.5 * 44.3mm/3,87*1.59*1.74in Click the Gear: once in 9 seconds - 99 times in 1 second
Features: 1.Auto Screen Clicking. 2.The Clicker Can Meet Your Screen Clicking Needs, Just Clip The Clicking Head On The Phone Screen To Simulate Your Finger Clicking The Screen Automatically. 3.Adjustable Gears. 4.Multi-Level Adjustable, The Clicker Can Support Any Mobile Phone, Tablet Pc And Touch Screen Pc. , Suitable For All Kinds Of Click Applications, It Will Save You A Lot Of Time. 5.Precise. 6.The Latest Capacitive Space Mapping Technology Greatly Improves The Clicking Speed, Makes The Click More Precise And Sensitive, Does Not Need To Touch The Screen, And Will Not Damage The Screen. The Silent Design Makes It Not Disturb You When Working. 7.Easy Installation. 8.Powerful Clip Click Head, Integrated Design, More Stable And Will Not Fall Off. The Click Head Can Be Rotated 180 Degrees To Fit For The Screen. 9.Easy To Use. 10.Easy To Use, Just Connect The Usb Interface To The Power Supply And You Can Use It Immediately, No Requirement For Complicated Adjustment. Packing List: 1* Auto Screen Clicker 1* Charging Cable",19.0,https://cdn.shopify.com/s/files/1/0914/7816/3826/files/2da89e780a7949f3abdc2472d93a3a6b.webp?v=1748113125,Other,digital-auto-screen-clicker-for-smart-phone-apps-video-live-streaming-gadget-smartphone-game-screen-touch-tripods-tapper,Pink-1
New Arrival Home Gadgets Smart Home Gadgets Electric Water Pump Folding Automatic Drinking Water Bottle Dispenser,"Product Parameter Color: White, white with base Product material :ABS Battery:1200mah battery Folding size :146*65*58mm Color box size :160*73*73mm Gross weight :270g/460g(white with base) Water yield: 1500ml per minute Standard configuration: USB cable * 1, manual * 1, food grade silicone tube * 1Features1. Product Features 1. Foldable Design,clean and easy to carry (folded shutdown, turn on automatic startup) 2. LCD Display, real-time recording of water output 3. Two operating modes:3-gears quantitative pumping(200ML/600ML/800ML) and coutinuous pumping 4.2in 1 Design, can put in on the bucket or any table. 5. Designed with safe material, no toxic and no smell,304stainless steel water outlet, health and environmental protection 6. Suitable for pure bottled drinking water, a variety of models gallon barrel with 4.5L-18.9L. 7. Built in USB rechargeable 1200mAh battery, can be used for 8 bottles of 18.9L water once full charged. Include: White:Water dispenser host×1 Inlet pipe×1 USB charging cable×1 Instruction manual×1 White with base:Water dispenser host×1 Inlet pipe×1 USB charging cable×1 Instruction manual×1 Product base× 1 Note: Due to the different monitor and light effect, the actual color of the item might be slightly different from the color showed on the pictures.",44.0,https://cdn.shopify.com/s/files/1/0914/7816/3826/files/22fdc698359840b5805a7b4b391a77e7.webp?v=1748113122,Other,new-arrival-home-gadgets-smart-home-gadgets-electric-water-pump-folding-automatic-drinking-water-bottle-dispenser,White Add Base
Smart Cigarette Ashtray Air Purifier Anion Purification Practical Automatic Purifier Ashtray Portable Gadgets for Car Ashtray,"Multipurpose Ashtray with Air Purifier Function for Filtering Second-Hand Smoke From Cigarettes Remove Odor Smoking Accessories Overview: 1. Durable. Made from very durable ABS plastic Easy to use, and easy to clean up. 2. A creative ashtray with an air purifier releases negative ions and air, multipurpose. 3. Convenient. Powerful, one button open, low, efficient, system 3600 RPM. 4. The ashtray tray is specially designed with four small grooves for fixing. cigarette butts, lightweight. Small size, easy, and convenient to carry. Product information: Noise: less than 36dB Power type: battery type Applicable scenario: family Color: battery style starry sky green (English), battery style fashion Gray (English), battery style modern white (English), square (green) English, square (gray) English, square (blue) English Energy efficiency level: Level 1 energy efficiency Applicable people: Smokers Applicable area: 11 ㎡ (inclusive)-20 ㎡ (inclusive) Function: eliminate odor, remove odor, mute design Style: creative style, simple style, Nordic style Packing list: Host * 1 Instruction * 1 Aromatherapy tablets * 1 Product Image: Smokeless Ashtray With Air Purifier, Intelligent Ashtray For Air Purification With Negative Ions For Car Home Smoke Removal Air Purification Ashtray Anion Purification Practical Automatic Purifier Ashtray Portable Gadgets for Home Offic/Car Ashtray",31.0,https://cdn.shopify.com/s/files/1/0914/7816/3826/files/1adff947b00946b3b48ff4cae9496e92.webp?v=1748113118,Other,smart-cigarette-ashtray-air-purifier-anion-purification-practical-automatic-purifier-ashtray-portable-gadgets-for-car-ashtray,Grey
Smart Cigarette Ashtray Air Purifier Anion Purification Practical Automatic Purifier Ashtray Portable Gadgets for Car Ashtray,"Multipurpose Ashtray with Air Purifier Function for Filtering Second-Hand Smoke From Cigarettes Remove Odor Smoking Accessories Overview: 1. Durable. Made from very durable ABS plastic Easy to use, and easy to clean up. 2. A creative ashtray with an air purifier releases negative ions and air, multipurpose. 3. Convenient. Powerful, one button open, low, efficient, system 3600 RPM. 4. The ashtray tray is specially designed with four small grooves for fixing. cigarette butts, lightweight. Small size, easy, and convenient to carry. Product information: Noise: less than 36dB Power type: battery type Applicable scenario: family Color: battery style starry sky green (English), battery style fashion Gray (English), battery style modern white (English), square (green) English, square (gray) English, square (blue) English Energy efficiency level: Level 1 energy efficiency Applicable people: Smokers Applicable area: 11 ㎡ (inclusive)-20 ㎡ (inclusive) Function: eliminate odor, remove odor, mute design Style: creative style, simple style, Nordic style Packing list: Host * 1 Instruction * 1 Aromatherapy tablets * 1 Product Image: Smokeless Ashtray With Air Purifier, Intelligent Ashtray For Air Purification With Negative Ions For Car Home Smoke Removal Air Purification Ashtray Anion Purification Practical Automatic Purifier Ashtray Portable Gadgets for Home Offic/Car Ashtray",20.0,https://cdn.shopify.com/s/files/1/0914/7816/3826/files/61b0eb3ea0b94329a8c0fc615e337997.webp?v=1748113115,Other,smart-cigarette-ashtray-air-purifier-anion-purification-practical-automatic-purifier-ashtray-portable-gadgets-for-car-ashtray,WHITE
Smart Cigarette Ashtray Air Purifier Anion Purification Practical Automatic Purifier Ashtray Portable Gadgets for Car Ashtray,"Multipurpose Ashtray with Air Purifier Function for Filtering Second-Hand Smoke From Cigarettes Remove Odor Smoking Accessories Overview: 1. Durable. Made from very durable ABS plastic Easy to use, and easy to clean up. 2. A creative ashtray with an air purifier releases negative ions and air, multipurpose. 3. Convenient. Powerful, one button open, low, efficient, system 3600 RPM. 4. The ashtray tray is specially designed with four small grooves for fixing. cigarette butts, lightweight. Small size, easy, and convenient to carry. Product information: Noise: less than 36dB Power type: battery type Applicable scenario: family Color: battery style starry sky green (English), battery style fashion Gray (English), battery style modern white (English), square (green) English, square (gray) English, square (blue) English Energy efficiency level: Level 1 energy efficiency Applicable people: Smokers Applicable area: 11 ㎡ (inclusive)-20 ㎡ (inclusive) Function: eliminate odor, remove odor, mute design Style: creative style, simple style, Nordic style Packing list: Host * 1 Instruction * 1 Aromatherapy tablets * 1 Product Image: Smokeless Ashtray With Air Purifier, Intelligent Ashtray For Air Purification With Negative Ions For Car Home Smoke Removal Air Purification Ashtray Anion Purification Practical Automatic Purifier Ashtray Portable Gadgets for Home Offic/Car Ashtray",16.0,https://cdn.shopify.com/s/files/1/0914/7816/3826/files/b6c60559bcf14593ad5ea2a678f7514a.webp?v=1748113110,Other,smart-cigarette-ashtray-air-purifier-anion-purification-practical-automatic-purifier-ashtray-portable-gadgets-for-car-ashtray,Square White
2.4G BT 5.2 Remote Control Wireless Gyroscope Air Mouse 7 Color Backlight USB Receiver Mini Keyboard for Android Smart TV Box PC,"2 . 4G MODE For initial use , plug a USB receiver into the USB port of device and wait for 20-60 seconds to install driver of USB receiver . Move the mouse the mouse cursor can move on the screen means that pairing is successful if it is unsuccessful , press and hold [ OK and [ BACK ] buttons , LED light begin to flash . Pairing is successful when LED light stop flashing BT 5.0 MODE 1 . Before using this device , first you must turn on the BT function of the lain device 2 . Then long press "" OK + Return keys , when the LED turns to flash quickly, the product enters the pre pairing 3 , Click add search new devices on the main device to find this air remotes name ( Example : BT-REMOTE ) . Click the name can to connecting 4 . After the product is successfully connected , the direction of the mouse pointer can be controlled by waving in the air 5 .If the connection is not successful , please perform the operation steps of item 2-4 again 6 . Reconnect efficiency description : The normal reconnect time of this product is 3-5 seconds after it is normally paired with the main equipment 7 . This product can only remember the pairing information of one main device , when the product is connected to a new device , the connection of historical devices is not supported after 8 . in this case . you need to delete the historical connection information of this peripheral can be successfully matched for new search CPIADJUSTMENT CPI ( Count Per Inch ) . Speed of the Mouse Cursor Adjustment ( 3 Levels ) , 1 , 2 , 3 Level . The higher the level , the faster the speed . The default speed is set at level 2 1 . Speed Increase Press OK button + Volume + ] button for about 3seconds , the work indicator flashes quickly and then goes off , release the button , CPI on the basis of the original increase 1 level 2 . Speed Decrease Press [ OK ] + Volume - for about 3 seconds , the work indicator flashes quickly and then goes off ,release the button , and CPI is reduced by 1 level on the basis of the original",31.0,https://cdn.shopify.com/s/files/1/0914/7816/3826/files/286cd1df334143149306e27182d94f3a.webp?v=1748113106,Other,2-4g-bt-5-2-remote-control-wireless-gyroscope-air-mouse-7-color-backlight-usb-receiver-mini-keyboard-for-android-smart-tv-box-pc,Backlight
3M LED Curtain String Lights Fairy Decoration USB Holiday Garland Lamp 8 Mode For Home Garden Christmas Party New Year Wedding,"About this item 【USB Powered & Safe to Touch 】The USB plug allows you to use multiple power source. The window light can plug in any usb-based charger unit, so you can easily power them anywhere.Made of 300pcs high efficient and environmentally friendly LED, the curtain fairy lights is safe to touch.Never get overheat after long time of usage. 【IP65 Waterproof &Perfect Decorations】9.8FT x 9.8FT fairy string lights can cover most windows, curtains, walls,pergolas. IP65 WATERPROOF which is perfect for indoor/outdoor patio decorations, doors, floors, ceilings, bedroom, livingroom, around the house, Christmas, Party, Valentine's Day, Holidays, outdoor wedding,party backdrop, shopping center etc. 【8 Light Settings & Timer Remote】Led curtain lights for bedroom inside with 8 different flash modes: combination, in waves, sequential, slogs, chasing/flash, slow fade, twinkle/flash, and steady on. You can light up your room in any mode by wireless remote. 6 hours On and 18 hours Off automatically every 24hrs once TIMER activated. [Package & Satisfied Customer Support]: 1 x LED window curtain string lights. NOTE: ONLY STRING LIGHTS, NO CURTAIN. Any question or concerns about led curtain light, please let us know. Our reliable customer service will reply within 8 hours. Note: 1. USB has buttons to switch modes. 2.Please allow 1-10mm difference due to manual measurement. 3.Due to light and screen difference, the item's color may be slightly different from the pictures. Specifications: 3*3m 300LED(Width 3 meters Height 3 meters) 3*2m 200LED(Width 3 meters Height 2 meters) 3*1m 100LED(Width 3 meters Height 1 meter)",14.0,https://cdn.shopify.com/s/files/1/0914/7816/3826/files/6c3ea36e91e14ca191f9f622f32d0d8d.webp?v=1748113090,Other,3m-led-curtain-string-lights-fairy-decoration-usb-holiday-garland-lamp-8-mode-for-home-garden-christmas-party-new-year-wedding,Multicolor
90cm Persian fern Leaves Vines Home Room Decor Hanging Artificial Plant Plastic Leaf Grass Wedding Party Wall Balcony Decoration,,14.0,https://cdn.shopify.com/s/files/1/0914/7816/3826/files/0f59581338ac4f6b8cdc1f5d49b9f75e.webp?v=1748113083,Other,90cm-persian-fern-leaves-vines-home-room-decor-hanging-artificial-plant-plastic-leaf-grass-wedding-party-wall-balcony-decoration,Ivy leaf
10Pcs Artificial Flower Realistic Touch Tulip Scrapbooking Vase Home Decor Wedding Garden Arch Garland  Mother's Day Bouquet diy,"Condition: 100% Brand New & High Quality Material: PU+Plastic Color: As the picture shows. Quantity: 1 lot=10pcs Size: Single head 3.8*5 cm,The pruning length is about 35 cm,(1cm=0.4 inch) Use: birthday send flowers, celebration of send flowers, love flowers, sympathy flowers, festival of flowers, home decoration! note: Due to different monitor and camera lights may cause slight color differences, mainly in kind of all colorserent sizes. entirely consistent with the picture",17.0,https://cdn.shopify.com/s/files/1/0914/7816/3826/files/1eee5bec12134c3b960ac7f8e1c3f056.webp?v=1748113073,Other,10pcs-artificial-flower-realistic-touch-tulip-scrapbooking-vase-home-decor-wedding-garden-arch-garland-mother-s-day-bouquet-diy,2
"Ultra Soft Plush Round Rug Mat - Fluffy White Carpet for Living Room, Home Decor and Bedroomr, Bedroom and Kids Room","【Comfy Living】 Put it in your comfortable living room or bedroom. Very soft and comfortable feeling. Perfect match with your home design! Imagine how relaxed it will be when you step on this 5cm plush carpet and return to your warm home after a long day of work. Very suitable as a holiday gift. 【FEATURES】 Plush material, elastic, anti-wrinkle, not easy to fade Hair length is 4.5cm, soft, comfortable and friendly skin texture There are many colors and sizes, and can be customized. Contact customer service 【EASY TO CLEAN】 For simple dust, take the carpet outdoors and pat the dust and hair on the surface of the carpet vigorously; if the carpet is dirty, it is best to wash the plush carpet with dry cleaning, and pay attention to the cleaning strength so as not to damage the fluff of the product. Blow dry with a hair dryer after cleaning, the effect is very good. 【Multi Use】 This plush carpet has a very chic and fashionable appearance, which is very suitable for indoors, living rooms, terraces, bedrooms, entrance passages, corridors, etc. 【Satisfaction Guarantee】 This product is machine-cut and cut, there may be slight differences, thank you for your understanding and support!",53.0,https://cdn.shopify.com/s/files/1/0914/7816/3826/files/6fed23e600c8490d9116eaf0c3fec487.webp?v=1748113050,Other,ultra-soft-plush-round-rug-mat-fluffy-white-carpet-for-living-room-home-decor-and-bedroomr-bedroom-and-kids-room,white
