title,description,price,images,category,handle,variants
"Outdoor portable basketball rack, suitable for children and adults, durable family game set",,112.0,https://cdn.shopify.com/s/files/1/0914/7816/3826/files/418e775d6d324438a5e45e30dba8aaab.webp?v=1748054872,Other,outdoor-portable-basketball-rack-suitable-for-children-and-adults-durable-family-game-set,Variant
"Wooden Step Stool For Adults, 9"""" Portable Wood Step Stool For Kids, Heavy Duty One Step Bedside Stool With 550 Lbs Load Acity,","Wooden Step Stool For Adults, 9"""" Portable Wood Step Stool For Kids, Heavy Duty One Step Bedside Stool With 550 Lbs Load Acity, Non-Slip White Foot Stool For Kitchen Bathroom Bedroom Product Dimensions16""""D X 10""""W X 9""""H : Color: Natural Special Feature: Heavy Duty Room Type: Bedroom ❤️【Sturdy & Durable Struction】Our Bla Wood Step Stool For Kids With Thi Wood And Reinforced Structure That Can Withstand Substantial Loads Up To 550 Lbs. Non-Slip Pads Under Each Leg Provide A Secure G On Floors Without Slip Or Slide And Prevent Your Floor Surface From Scratches. ❤️【Perfect 9'' Height】With Our 9"""" Step Stool Wood, This Height Carefully Balance Accommodate Adult And Children For Different Daily Activities. Providing Perfect Accessibility And Comfort, Making A Versatile Application With Wide Step Stool In Your Life. ❤️【Easy To Assemble】The Wooden Foot Stool Build With 16''L X 10''W X 9'' H Size Versatility Meets Both Adult And Children Needs. It'S Very Easy To Assemble With Pre-Drilled Holes And Screws Accessories Fix It Stably. Integrated Handles Add Portability, Allowing You To Move The Bed Step Stool Around The House Conveniently. ❤️【Multifunctional Application】The Portable Wooden Steps Stool Can Be Used In Various Household Need Such As Bathroom Step Stool, Bedside Step Stool, Kitchen Step Stool, Potty Training Stool, Plant Stools Indoor, Camping Stools For Adults, Step Stool For Dogs, Stair Assist, Suv Car Step Stool Etc.Also Great Gift For Family And .",102.0,https://cdn.shopify.com/s/files/1/0914/7816/3826/files/cbf8733137bb46b783145ab3f5db1fef.webp?v=1748054870,Other,wooden-step-stool-for-adults-9-portable-wood-step-stool-for-kids-heavy-duty-one-step-bedside-stool-with-550-lbs-load-acity,MULTI
"WIN.MAX Basketball Hoop Outdoor 3.8-10ft Adjustable Height, 44inch Backboard, Basketball Hoop & Goal for Kids/Adults Indoor","About this item 【Professional basketball goal system】This is not a ordinary basketball hoop toy, but the PROFESSIONAL basketball starter training set, WIN.MAX Basketball Hoop uses an 18"" standard size basketball rim and a 10ft-high standard support rod (adjustable) to bring you a perfect sports experience. Basketball dream, starts with WIN.MAX! 【Leading height adjustment range】Win.max basketball hoop have the widest height adjustment range on the market, Provides 18 levels for height adjustments, easy height adjustments from 3.8 ft to 10 ft. When you only install two steel poles, 3.8’ to 6.6' height adjustability(in 4.8"" increments); When installing all three steel poles, 7.3’ to 10' height adjustability(in 4.8"" increments). 【Multifunctional basketball hoop】The height adjustment range of 3.8-10FT allows this product to be used in multiple scenarios. In summer, you can lower the height to 3.8FT and place it by the pool as a swimming pool basketball hoop. In winter, you can adjust the height to 6.6FT and put it indoors, so that children can practice basketball in winter. In spring, you can adjust the height to 10FT and put it in front of the garage door, enjoying the fun of basketball with your family 【SUPERIOR STABILITY】The product adopts a new base design, which can only be filled with water, or just place heavy objects in the grooves, or it can be filled with water and then placed with heavy objects to make its support more stable. Strong enough for inclement weather and intense gaming for long-lasting use! 【LASTING DURABILITY 】WIN.MAX Outdoor Basketball Hoop has a Shatterproof 44’’ upgraded backboard, made of high strength materials. The design of the shock-absorbing bumper of the basket can reduce the impact force caused by the collision. Support rod adopts Q195 thick steel designed, Raw material and fine craftsmanship ensures long lifespan. Win.Max portable basketball hoop always accompany you and grow up with you! 【Excellent After-Sales】If you have any problems with the product you purchased, please contact us through Amazon, WIN.MAX's professional after-sales team will reply you within 24 hours and help you solve the problem!",234.0,https://cdn.shopify.com/s/files/1/0914/7816/3826/files/b1c5d04edb6541bfa9c206b941b2c1e2.webp?v=1748054868,Other,win-max-basketball-hoop-outdoor-3-8-10ft-adjustable-height-44inch-backboard-basketball-hoop-goal-for-kids-adults-indoor,Variant
"Basketball Hoop System with 44"" Shatterproof Backboard – Adjustable Height 5.25FT to 10FT, Ideal for Youth, Teens, and Adults","About this item Effortless Height Adjustment: Easily adjust the hoop from 5.25ft to 10ft with a simple handle rotation, perfect for kids, teens, and adults. Quick setup for endless fun! Durable Upgraded Backboard: The 44-inch impact-resistant, weatherproof PC backboard ensures long-lasting durability. Iron-wrapped edges protect against wear and extend the hoop’s life. Enhanced Rim with Shock Absorption: The 18-inch rim features dual-spring damping for reduced impact and improved durability, providing reliable performance season after season. Versatile Indoor & Outdoor Use: Move it effortlessly with built-in wheels—perfect for the backyard, driveway, or even indoors. Enjoy family fun anywhere, anytime. Sturdy & Stable Design: The large base, capable of holding up to 150lbs of water or sand, ensures maximum stability. The triangular frame and 4 support rods add extra safety during intense games. Quick & Easy Assembly: All tools and accessories are included. Follow the clear manual for a fast, stress-free setup. Missing or damaged parts? Our support team is ready to help. Dedicated After-Sales Support: At Ukeep, we prioritize customer satisfaction. Our team is always ready to assist, ensuring a smooth experience long after your purchase.",396.0,https://cdn.shopify.com/s/files/1/0914/7816/3826/files/34b03edfb48042fabdd919c3a0249c4e.webp?v=1748054866,Other,basketball-hoop-system-with-44-shatterproof-backboard-adjustable-height-5-25ft-to-10ft-ideal-for-youth-teens-and-adults,Variant
1pc Pool Table Cutting Dies Ball Game Stencils Billiards Player Decorative Embossing Stencils for Scrapbooking Photo Album,"Product Description Ball Game: The template includes a scene of two billiards players playing billiards, which is very suitable for leisure and entertainment. The rich patterns add luster to your handmade work. Size Reference: Including 1pcs sports cutting dies, size: about 181mm/7.1"" wide, 116mm/4.56"" long, 0.8mm thick. Can be made according to your own creativity Quality Material: Made of premium carbon steel with fine craftsmanship and delicate cutting edges, sturdy and durable for long term use; Stainless steel color Easy to Use: Choose the pattern you want and place it on paper and other cuttable items, then cut along the edges of the template and you will get a new pattern and many of the decorations. Matching with die cutter, the effect is better Wide Usag: Suitable for scrapbooking, greeting card making, paper crafts, themed invitations, pocket scrapbooking, album, photo frames and other paper craft projects for festival decorations.",26.0,https://cdn.shopify.com/s/files/1/0914/7816/3826/files/c0c87f23b8d443218692a2dfd8f432ec.webp?v=1748054862,Other,1pc-pool-table-cutting-dies-ball-game-stencils-billiards-player-decorative-embossing-stencils-for-scrapbooking-photo-album,AECH06-02689
"Soozier 55"" Portable Folding Billiards Table Game Pool Table for Whole Family Number Use with Cues, Ball, Rack, Chalk","About this item other Miniature Classic Table: It is a professional small pool table table, you can improve your angled and pocket shots in smaller living areas with this compact table. Authentic Look and Feel: With an authentic green felt covering and bumper cushions, this billard pool table you will feel like you'e playing on a full-sized table, only smaller. Includes Full Pool Set: This game table set comes with a full set of balls (1.5"" diameter), a rack, two pool cues (37"" long), chalk, and 6 ball pockets so you can start playing as soon as the table is assembled. Folds Down for Storage: When not in use, this gaming tables'legs can be folded down making it easy to transport and simple to store. Perfect for Both Kids and Adults: This is the perfect pool table to teach beginner pool on and can be used by either kids or adults. Each table leg is equipped with an adjustable foot pad to keep the balance.",307.0,https://cdn.shopify.com/s/files/1/0914/7816/3826/files/f8f4f992e7cb43aab1e527d34a7e3f3d.webp?v=1748054859,Other,soozier-55-portable-folding-billiards-table-game-pool-table-for-whole-family-number-use-with-cues-ball-rack-chalk,Variant
Dustproof Waterproof 7 8 9 Foot Outdoor Full Pool Solid With Drawstring Billiard Table Dust Cover Table Protector 210D Oxford,"Bullet Points: 1,UNIVERSAL SIZES --- Three different sizes of 7 foot, 8 foot and 9 foot fit most of billiard tables on the maket. Check the detailed dimensions in the size picture or product description. We recommend you measure your table before purchasing one that fits most. 2,ALL-ROUND FULL COVERAGE --- Unlike other covers that only protect the tabletop, these fitted billiard table covers provide a full range of protection from children, pets, wild animals, dust, dirt, birds poop and bad weather. 3,DURABLE MATERIAL --- These snooker table covers are made of high-density Oxford fabric with silver plated undercoating, better than those cheap nylon fabric, provide excellent water/wind/snow/dust/sunlight/rip resistance, keep your pool table clean and secure. 4,UNIVERSAL USE --- Not only for pool tables, but also great for other gaming tables, such as table tennis or hover hockey, as well as outdoor table and patio furniture set, etc. FEATURES: 1,Full range of coverage. 2,Easy to install and fit with drawstring. 3,Durable material with ilver plated undercoating that reduces damage from the sun rays. 4,Superb double-stitched sewing tech adds strength, makes it hard to crack. 5,Black color won't show dirt obviously, so it won't look awful after a period of inactivity. 6,Easy to wash, you can rinse it directly with a tap, or soak it in cold water and then hang it dry. SPECIFICATIONS: Name:Billiard/Pool Table Cover Condition: 100% Brand New Material: Oxford Colour: Black & Silver Dimensions (Length * Width * Height): A# 7-foot: 7.4x3.8x2.7 ft / 89x46x32in / 225x116x82 cm B# 8-foot: 8.5x4.2x2.7 ft / 102x53x32in / 260x135x82 cm C# 9-foot: 9.4x5.1x2.7 ft / 113x61x32 in / 287x155x82 cm List: 1*Pool Table Cover",37.0,https://cdn.shopify.com/s/files/1/0914/7816/3826/files/aafc3bc48a9b4fc9a57b2ddda859a667.webp?v=1748054856,Other,dustproof-waterproof-7-8-9-foot-outdoor-full-pool-solid-with-drawstring-billiard-table-dust-cover-table-protector-210d-oxford,Black
SMALL BILLIARDS  Mini tabletop pool billiard for kids and family indoor,"This is a multi-specification product, if you need other specifications, please contact customer service. Confirm quote whatsapp account +86 185 2585 1731 The selling price of all products does not include customs duties. The selling price of all products does not include customs duties. The selling price of all products does not include customs duties.",38.0,https://cdn.shopify.com/s/files/1/0914/7816/3826/files/d2828e08a2e14423add823f6a743a820.webp?v=1748054854,Other,small-billiards-mini-tabletop-pool-billiard-for-kids-and-family-indoor,Pictured
12x Billiard Pool Table Cushion Facings Anti Skid Rubber Pad Rail Bumpers Rubber Facings Pool Table Replacement Pad,"Description: 【Pool Billiard Table Cushion Facings】Used on the ends where the rubber cushion and the Billiard table rail meet, used for replacing the rubber cushion rails on your pool table. 【Protective Equipment】These rubber facings provide a better protection between that bonding and protect the billiard guide rail when the balls are landing. 【Durable Material】 Cushion facings made of rubber and cloth material, high strength, strong and durable. Thickness: 0.18"" (4.5mm). 【Adjustable Size】Each rubber facings pad can be trimmed to ensure fit with your billiard pool table well. Use these rubber facings at the ends of rails when replacing your rubber cushions. 【Package Include】Includes 12 strips, comprised of 8x corner pockets facings and 4x side pocket facings, sufficient quantity can meet your needs. Specification: Material: Rubber Size: Flat Angle: Corner Pockets Facings: 9.6cmx4.6cm/3.78inchx1.81inch Side Pocket Facings: 6.7cmx4.6cm/2.64inchx1.81inch Thickness: 0.45cm/0.18inch Bevel: Corner Pockets Facings: 9.7cmx4.6cm/3.82inchx1.81inch Side Pocket Facings: 6.2cmx4.6cm/2.44inchx1.81inch Thickness: 0.45cm/0.18inch Package Includes: 8X Corner Pockets Facings 4X Side Pocket Facings Note: 1. Please allow slightly error due to manual measurement. 2. Due to the difference between different monitors, the picture may not reflect the actual color of the item. 3. Wish you a wonderful on-line shopping!",18.0,https://cdn.shopify.com/s/files/1/0914/7816/3826/files/ee9639a869884e6287721c647626a595.webp?v=1748054852,Other,12x-billiard-pool-table-cushion-facings-anti-skid-rubber-pad-rail-bumpers-rubber-facings-pool-table-replacement-pad,Bevel
Inflatable Beer Pong Raft Floating Drink Holder for Lake Water Sports Summer,"Description: 【Versatile Design】: This inflatable beer pong table features 10 cup holders on each side, ensuring your cups stay secure during games. It's good for poolside fun, social floating, or as a cocktail table 【Material】: Made from PVC material, this float is built to last and can withstand countless games and parties without wear and tear 【Easy to Inflate and Deflate】: Designed for convenience, it can be quickly inflated with a pump and deflated just as easily for hassle-free transport and storage 【Good for Any Occasion】: Whether it's a summer pool party, family gathering, fraternity event, carnival, spring break trip, or beach BBQ party, this inflatable game table is an ideal addition to your festivities 【Generous Size】: Measuring 58X10X150 cm, it provides ample space for playing beer pong while also serving as a comfortable floating lounge or drink station in the pool Specification: Material: PVC Size Chart: 58cmx10cmx150cm/22.83inchx3.94inchx59.06inch Package Includes: 1 Piece Inflatable Beer Pong Raft(Cups and balls are not included) Note: Please allow slightly errors 1-2cm/0.39-0.79inch differences due to manual measurement.",74.0,https://cdn.shopify.com/s/files/1/0914/7816/3826/files/aa5d0c39ed4d4e79b201a4d37e0c9c6b.webp?v=1748054166,Other,inflatable-beer-pong-raft-floating-drink-holder-for-lake-water-sports-summer,Variant
Craftsmanship Sexy Hollow Sex Set Chain Sexy Bodysuits Backless Wrap Chest Suspenders Sleeveless Charming Elegant Beautiful 34B5,,22.0,https://cdn.shopify.com/s/files/1/0914/7816/3826/files/9eaf7fae55eb414c87d685287396c4a8.webp?v=1748054163,Other,craftsmanship-sexy-hollow-sex-set-chain-sexy-bodysuits-backless-wrap-chest-suspenders-sleeveless-charming-elegant-beautiful-34b5,Black
Slim Exotic Sexy Tops Underwear Sexy Sex Open Crotch Bodysuit Funny Anime Women Rompers Clothing Body Suits Lace Jumpsuit JJC4,Recommended weight:40-65kg Recommended height:150-175cm,24.0,https://cdn.shopify.com/s/files/1/0914/7816/3826/files/dd6d3e74a33c43a8a079f0460a383d34.webp?v=1748054160,Other,slim-exotic-sexy-tops-underwear-sexy-sex-open-crotch-bodysuit-funny-anime-women-rompers-clothing-body-suits-lace-jumpsuit-jjc4,112 Grey Stockings
1/6 SFD Red Suit Witch Magical Girl Fighting Female Figure Tall 28cm BJD Action Figure Doll Soft Silicone Model Toys,"1/6 SFD Red Suit Witch Magical Girl Fighting Female Figure Tall 28cm BJD Action Figure Doll Soft Silicone Model Toys Size : height : 28 cm Bust ：15 cm Waist ：10.5 cm hips ：15.6 cm Tips : Slight color difference between head and body , thanks . Material: Metal Joint Skeleton + Silicone Note : Just a toy , Not a sex doll . thanks !!!",293.0,https://cdn.shopify.com/s/files/1/0914/7816/3826/files/187d035fa51545c3af63e711886a7ab9.webp?v=1748054159,Skin Care,1-6-sfd-red-suit-witch-magical-girl-fighting-female-figure-tall-28cm-bjd-action-figure-doll-soft-silicone-model-toys,Variant
"1/6 Scale Trendy Figure Doll Accessories Clothes Sex White Long Sweater Dress Model Toy fit 12"" TBL PH Jiao Doll Female Body DIY","1/6 Scale Trendy Figure Doll Accessories Clothes Sex White Long Sweater Model Description: 1. Scale: 1/6 2.Color:as picture 1/6(12"") Action Figure Accessory 100% Brand New , Never Been Played Note: not include the head, shoes, and the BODY and other accessories.",35.0,https://cdn.shopify.com/s/files/1/0914/7816/3826/files/e2302de6896545008a254b145aac11ab.webp?v=1748054156,Other,1-6-scale-trendy-figure-doll-accessories-clothes-sex-white-long-sweater-dress-model-toy-fit-12-tbl-ph-jiao-doll-female-body-diy,Only sweater
7.0MM TYPE-C Endoscope Camera IP67 Waterproof 6 LEDs Adjustable USB Android Flexible Inspection Borescope Cameras for Phone PC,"7.0MM TYPE-C Endoscope Camera IP67 Waterproof 6 LEDs Adjustable USB Android Flexible Inspection Borescope Cameras for Phone PC Notice This item only works with Android 4.0 and above 4.1,4.2 system phone, does Not support iOS system; Support Android Phone which has OTG and UVC function (Your smart phone must be Genuine which have license and support external camera, make sure that it will not shield the external camera). Features -1- Latest Model for Android phones,can take Photo,video and Sound recording, and the photos & video file will directly stored in your Android mobile phone, the whole process of record check, convenient observation and follow-up analysis. -2- It has a turning wheel used for adjusting the brightness of six LED lights so that work in some areas without enough light. -3- It is IP67 Waterproof Camera with TYPE-C and USB, It can also be used on computers. -4- Ideal for intraoral camera system, underwater camera, waterproof Micro-cameras, motor vehicle detector, sewer pipeline detector. -5- Best for search and rescue, criminal and custom detector, archaeological detect, the PCB detection, home care, aviation and space industries. -6- For care and tractors industries, petroleum drilling industries, constructions and so on. Specification: -1- High resolution with 1/9 CMOS camera. -2- Built-in 6 LED light (with Brightness and take Photo Control) -3- Waterproof wire endoscope. -4- Camera head dimeter: 7.0mm -5- Photo shooting and video recording. -6- Resolution:  640 x 480 -7- LED: 6 White LED Bright light. -8- Focal distance: 3cm-8cm. -9- Waterproof level: IP67. -10- Support systems: Android /Windows 2000 / XP / Vista / 7/8/9/10 -11- Temperture: -20 ~ 100 degree -12- Cable total length: 1m/1.5m/2m Package Includes: 1 x Mini USB Endoscope 1 x Small hook 1 x Magnet 1 x Side audition 1 x fixed set 1 x C to USB interface 1 x User's Manual Instructions: -1- Scan the QR code on the Manual to install APP, or download link to install APP, then an icon appears on mobile desktop, click on the icon, the product is available to use. It's very easy to operate this android endoscope, just download an APP and inserted the endoscope in your device, the APP will automatic recognition it , then start to use ! (Please make sure your phone has OTG function and supports external camera.) -2- You can scan the QR code in the manual to install the APP. If the APP cannot be supported, you can scan and install the ""inskam"" APP.",23.0,https://cdn.shopify.com/s/files/1/0914/7816/3826/files/aa616b0daea747f7ba600f9d9d2aca6d.webp?v=1748054152,Other,7-0mm-type-c-endoscope-camera-ip67-waterproof-6-leds-adjustable-usb-android-flexible-inspection-borescope-cameras-for-phone-pc,2m
160x60cm Car Wash Towel 400GSM Microfiber High Water Absorption Cleaning Towels Thickened Soft Car Washing Drying Cloth,"160x60cm Car Wash Towel 400GSM Microfiber High Water Absorption Cleaning Towels Thickened Soft Car Washing Drying Cloth Specification: Product name: Microfiber car wash towel Material: Coral velvet Size: 160x60cm Color: Blue/grey/grey yellow Super absorbent: 400GSM Function: Double-sided super absorbent Feature: 1.160cm x 60cm ultra-fine fiber large size towel makes it more convenient to clean the car and wash the car. 2.It is super clean and practical. The dust in small corners can also be cleaned without leaving dust. 3.Wipe the car without leaving any marks, whether it is paint, glass, dashboard, interior decoration, furniture, etc. 4.Thickened fabric with strong water absorption; Excellent fiber, soft feel. 5.Exquisite locking, using a binding design, excellent workmanship, and aesthetic upgrade.",27.0,https://cdn.shopify.com/s/files/1/0914/7816/3826/files/fd0d9918b53c4e0bbdf67dac8ff5ba3c.webp?v=1748054150,Other,160x60cm-car-wash-towel-400gsm-microfiber-high-water-absorption-cleaning-towels-thickened-soft-car-washing-drying-cloth,160x60cm
Portable Button Fascia Gun Deep Tissue Massage Mini Lightweight and Adjustable Speed Massage Equipment Suitable for the Body,"Description • Deep Tissue Massage : This fascial gun provides deep tissue massage, reaching areas that conventional massage techniques cannot, offering relief from chronic pain and tension. • Handheld Percussion Massager: The handheld percussion massager design allows for easy reach and precision targeting of muscle groups, ensuring a comprehensive and effective massage experience. • Full Body Application : Ideal for full-body use, this massage gun can help alleviate discomfort in the back, neck, legs, and other areas, promoting general wellness and relaxation. • Relaxation Function : Designed specifically for relaxation, this massage gun can help unwind tight muscles, improve blood circulation, and reduce stress. • Portable Design : Its compact and lightweight design makes it easy to carry around, allowing you to enjoy a relaxing massage anytime, anywhere. •Special Features :Type C -USBRechargeable •Target Use Body Part :Whole Body •Power Supply :Battery Powered (no Plug) Features: 1.Carefully researched and developed, so that the fascia gun is no longer bulky, lightweight body is only the size of a cell phone, the little girl can also be operated with one hand. 2. After using the hand loaded into the pocket, do not need to organize the bag, minus the redundant cumbersome massage relaxation really into your life. 3. Chip micro-program control operation, smooth speed refuses to lag effectively reduce the noise generated. Package included: Gun Band * 1 Notice: 1. Due to the difference in display, shooting light and environment there will be some color difference between the actual color andthe picture color, which is normal. 2. Due to manual measurement, the size of the product may have 0.5-1cm difference. 3.lf you have any questions, please contact us first and we will solve it for you.",38.0,https://cdn.shopify.com/s/files/1/0914/7816/3826/files/912462e1f661451297df3b77124a252b.webp?v=1748054147,Other,portable-button-fascia-gun-deep-tissue-massage-mini-lightweight-and-adjustable-speed-massage-equipment-suitable-for-the-body,Black Button
Solar Outdoor Led Courtyard Wall Lamp Human Body Induction Garden Terrace Garage Door Street Lamp 616,"• Human Body Induction : The lamp is equipped with a human body induction feature that automatically turns on when it detects movement, making it convenient to use in dark areas. • Energy Efficient : The lamp is powered by solar energy, making it an eco-friendly and cost-effective option for outdoor lighting. • Versatile Use : The lamp can be used in various settings such as gardens, patios, garages, and streets, making it a versatile lighting solution for outdoor spaces. • Easy Installation : The lamp is easy to install and can be mounted on any wall without the need for complicated wiring or electrical work. Specification Solar panel: 5.5V/2.5W Product size: 227*84*40mm Steps for usage: 1 . Turn on the main switch when using the producthe mrst time2 . Press the green 'on off button to power on the lamp or adjust the modes.3 . There are three modes to adjust Notice Mode 1: human body detection mode (the light power 100% brightness when aperson walks by, and it is off after 20 seconds)Mode 2: human body induction + low light mode (the light power 100%brightness when people pass, and power 30% dim brightness after 20seconds)Mode 3: Light up with 50% low brightness always.",22.0,https://cdn.shopify.com/s/files/1/0914/7816/3826/files/e5beb3a6876142dcb17031d7e6795b20.webp?v=1748054144,Other,solar-outdoor-led-courtyard-wall-lamp-human-body-induction-garden-terrace-garage-door-street-lamp-616,black
