title,description,price,images,category,handle,variants
Interactive Cat Toys Ball Auto Electric Rolling Ball Toys for Cats/Kitty Pets Smart Automatic Teaser USB Rechargeable,"Features: 1.Interactive Fun: The electric cat ball toys is a smart toy that provides endless entertainment for your beloved feline friend. With its automatic rolling feature, this interactive ball engages your cat's curiosity and encourages playful behavior. The silent motor ensures a quiet operation, allowing your cat to enjoy hours of fun without disturbing the household. Let this interactive ball become your cat's favorite toy, providing them with both physical exercise and mental stimulation. 2.Durable and Safe: The carefully designed exterior of the automatic ball toys is made to withstand the playful nature of cats. Constructed with high-quality materials, it offers durability and longevity. The ball's surface has a textured grip, making it easy for your cat to grab and play with. Rest assured that this toy is safe for your furry friend, as it is made from non-toxic materials and has no small parts that could be swallowed. 3.Easy Operation: Operating the rolling cat toys is a breeze. Simply press the power button, and the ball will start rolling automatically. The built-in smart sensor ensures that the ball changes direction when encountering obstacles, keeping your cat engaged and entertained. No need for manual intervention - let this toy do the work while you sit back and enjoy watching your cat's excitement. 4.Exercise and Mental Stimulation: Encourage your cat to stay active and maintain a healthy lifestyle with the smart interactive cat toy. By providing a moving target, this toy promotes exercise and helps prevent obesity in cats. Additionally, the unpredictable rolling patterns of the ball stimulate your cat's natural hunting instincts, keeping their mind sharp and engaged. It's the perfect way to keep your cat entertained and mentally stimulated, especially during times when you're not available to play with them. 5.Perfect Companion: The self rotating ball is not only a toy but also a companion for your feline friend. Whether you're busy with work or away from home, this toy keeps your cat company and alleviates boredom. Its engaging features and independent operation make it an ideal choice for providing entertainment and companionship to your beloved pet. Specification: Origin: Mainland China Material: ABS Size: 4.1*4.1m/1.61*1.61inch Use: USB Charging Battery Capacity: 80MAh Note: Due to the different monitor and light effect, the actual color of the item might be slightly different from the color showed on the pictures. Thank you! Please allow 1-2cm measuring deviation due to manual measurement.",18.0,https://cdn.shopify.com/s/files/1/0914/7816/3826/files/810f91166d1b49e19f34390c21da50dc.webp?v=1748110303,Other,interactive-cat-toys-ball-auto-electric-rolling-ball-toys-for-cats-kitty-pets-smart-automatic-teaser-usb-rechargeable,Gray Tail ball
"Knew Built Corgi Dog Micro Mini Building Blocks Toys: Adorable Model for Pet Lovers, Recreation, Perfect Display and Gift Idea","Corgi Dog Micro Mini Building Blocks Toys: Adorable Model for Pet Lovers, Fun and Educational Recreation, High-Quality ABS Plastic, Perfect Display Piece and Gift Idea 1,cute and Charming Corgi Model: Delight in assembling a miniature replica of the beloved Corgi breed, sure to bring a smile to anyone's face with its adorable details. 2,Educational Recreation: Enjoy a fun and educational experience that promotes creativity and dexterity while constructing this intricate model, perfect for all ages. 3,High-Quality Materials: Made from premium, non-toxic ABS plastic, ensuring a safe, durable, and reliable building experience. 4,Perfect for Display: Once assembled, the Corgi model serves as a cheerful and heartwarming display piece for home, office, or any pet lover's collection. 5,Great Gift Idea: An ideal gift for birthdays, holidays, or any special occasion, especially tailored for Corgi enthusiasts, dog lovers, and building block fans. Summary: ===== The Corgi Dog Micro Mini Building Blocks Toy offers a delightful and smile-inducing building experience with its cute and detailed Corgi model. Made from high-quality ABS plastic, it ensures a safe and fun activity that promotes creativity and fine motor skills. Once completed, it becomes a charming display piece, making it an excellent gift for dog lovers and building block enthusiasts. Available now on Aliexpress! Feature of blocks: 1. Educational value: According to the paper instructions, assembling can exercise the child's hand-brain skills and improve their patience. A patient child can get things done. 2. Fun with family: It is suitable for families to assemble together, which can promote communication among family members. Parent-child interaction can enhance the parent-child relationship. 3. Kill the time: It's a very nice pastime project to get rid of loneliness. Enjoy doing one or two steps each evening or weekend. 4. Nice family decorations and collectibles: It is extremely amazing when you put the blocks together, and then you can put it on a showcase or office desktop 5.Great gift ideas: For any occasion, such as New Year's Day, Christmas, Birthdays, Children's Day, Easter, Halloween, Hanukkah, STEM, summer camp activities, and back to school. Real Photo shot: FAQ F:How to assemble the product after purchasing? Q:Assembly instructions are included in the product packaging. Some products also have assembly videos. With the help of the assembly instructions, you can easily assemble the model. F:I am giving this product as a gift, is the product packaged? Q:To save on shipping, lower prices. Product does not come in a carton unless otherwise stated. We pack the bricks in bags. If you need a box for a product, our store has a link to the box. You can also contact with us. F:Are the particles of the product compatible with LEGO? Q:The product is a micro block, there is no way to be compatible with LEGO. It is smaller than the LEGO. Including small parts, please pay attention to kids under 3 years old. F:What should I do if the product received the goods is missing particles? Q:Because we are factory direct. We will send you some extra pellets for backup. Lack of particles usually does not occur. We recommend that you use small cups to keep the pellets separate while assembling. If the particles are missing, please contact our customer service and we will reissue it for you. Shipment Usually after you pay, we will check the product and then package and ship within 24 hours. (Holidays and non-working days will be delayed.) You can check the logistics information of your package within 1-3 days after dispatch. Shipping time according to your country or shipping method. You will receive your package within 7-60 days.",39.0,https://cdn.shopify.com/s/files/1/0914/7816/3826/files/c3cfb8fee2084afe82ed5386227c767a.webp?v=1748110298,Other,knew-built-corgi-dog-micro-mini-building-blocks-toys-adorable-model-for-pet-lovers-recreation-perfect-display-and-gift-idea,Dachshund Blocks
12 Styles Micro Animal Building Blocks Mini Bricks Animals Model Dog Cat Bird Elephant Puzzle Toys for Children Birthday Gifts,"SPECIFICATION: Product name:Animals blocks toys Block Size : Micro building block Plastic Block Shape : Self-Locking Bricks Block model:Animal Materials : Plastic Plastic Type : ABS Warning : Small part not for the kids under 3 years old Recommend Age : 6+ Origin : Mainland China FEATURES: 1.Mini block construction animals: use a small block to build animals, cultivate children's hands-on ability. the blocks are made of plastic and are not easy to break. 2.toy for children and adults.decoration for children's rooms. PACKAGE LIST : 1 *block NOTE: Due to hand measure,Normally the allowable differences in the size are approximately 1 inch in measurement. Differences in color may be caused by some other reasons such as color reflection in the monitor, lighting, background etc.",15.0,https://cdn.shopify.com/s/files/1/0914/7816/3826/files/7c39e0cdca2749e39086824e65b0a808.webp?v=1748110294,Other,12-styles-micro-animal-building-blocks-mini-bricks-animals-model-dog-cat-bird-elephant-puzzle-toys-for-children-birthday-gifts,tiger
Animal Micro Building Blocks Sets Ocelot Ragdoll Cat Dog 3D Model Husky Collie Mini Figure Brick Toys Schnauzer For Kids Gift,"Kawaii Siamese Ocelot Ragdoll Pet Mini Building Blocks Sets Cat Dog 3D Model Husky Collie Brick Toys Schnauzer For Kids Gift Wholesale order get discount, please contact Customer service!! ABS Safety and environmental protection materials. Age 8+ , not for little kids.",12.0,https://cdn.shopify.com/s/files/1/0914/7816/3826/files/e683e4c98b114f10a87f9d96481a98f9.webp?v=1748110287,Other,animal-micro-building-blocks-sets-ocelot-ragdoll-cat-dog-3d-model-husky-collie-mini-figure-brick-toys-schnauzer-for-kids-gift,224 Cow Cat
Big Building Block Accessories Chicken Duck Dog Cat Bird Cattle Sheep Zebra Rhinoceros Insect Zoo Series DIY Duploes Toy Gift,"Shopping tips: 1. Compatibility:Perfect compatible with Major Brand Particles Block Toys. 2. Material: Non-toxic, odorless, harmless ABS. 3. Package: We take off the original box just to save shippment charge for our customers. 4. Quality: Our goods are brand new, If the received goods cannot be used normally, please do not worry, please contact us in time, we will have a better solution. 5. Color: Because the factory produces different batches, some blocks cannot be fixed to provide a specific color. So will be shipped in random colors, if you like a specific color, please leave a note in the order, we will try our best to meet the demand. * There are many types of items, if you need to buy many items, you can add the items to the shopping cart one by one, and finally submit the order together. We will pack all the items in one package. * Low-priced orders cannot use the official fast logistics, so the goods usually take a long time to be delivered. It is recommended to take a look at other items in our shop when buying. If there is a demand, you can buy them at the same time, so that we can use safer and faster logistics to transport the goods for you.",11.0,https://cdn.shopify.com/s/files/1/0914/7816/3826/files/6a4843403d8049249c25017f74b28de0.webp?v=1748110272,Other,big-building-block-accessories-chicken-duck-dog-cat-bird-cattle-sheep-zebra-rhinoceros-insect-zoo-series-diy-duploes-toy-gift,Birdie
Pet Chew Toy Soft Rubber Bite-resistance Bone Shape Teeth Grinding Chewing Toys for Small Dogs Training Pet Supplies,"Pet Toys for Small Dogs Rubber Resistance To Bite Dog Toy Teeth Cleaning Chew Training Toys Pet Supplies Puppy Dogs Description: --100% brand new and high quality. --Super cute, light and nice looking design. --Made of non-toxic high quality TPR material, light and soft but very durable,100% safe. --Suitable for pets fetch, training, chewing and teething. --Can exercise the sensitivity of pets during playing with it. --When dog play it, the ball will make a sound. --A great toy for your lovely pet to have fun. Name: Pet spiked molars toy Packing: 1pc random color",15.0,https://cdn.shopify.com/s/files/1/0914/7816/3826/files/03f832c6dd4b42da8d5d397495f35cb9.webp?v=1748110267,Other,pet-chew-toy-soft-rubber-bite-resistance-bone-shape-teeth-grinding-chewing-toys-for-small-dogs-training-pet-supplies,Nipple
Sexy Underwear Women Gather No Steel Ring Lingerie Bra Tube Top Wrapped Chest Beauty Back Actival Cotton Thin Section Tube Top,"• Seamless Design :This women's brassiere bra features a seamless design, providing maximum comfort and preventing any irritation or discomfort during use. • Full Cup Support :The full cup design of this bra ensures ample support and coverage, enhancing your natural curves while maintaining a neat appearance. • Breathable Material :Crafted from high-quality knit material, this bra is breathable, allowing for excellent air circulation and keeping you cool and comfortable throughout the day. • Wire-free Comfort :The wire-free design of this bra offers greater comfort and flexibility, eliminating any discomfort or restrictions during your daily wear. • Suitable for Yoga :This bra is perfect for yoga enthusiasts, offering the right amount of support and breathability for a rigorous yoga session. • High-quality Craftsmanship :With its superior craftsmanship, this bra is not only functional but also durable, ensuring long-lasting use. • Wire-free design for maximum comfort :No wires means no discomfort or irritation during your workout. Product Details Size One Size Gender Female Material Polyester & Spandex & Nylon Packing OPP bag Season Four Seasons Notes 1. Manual measuring, please allow slightly measurement error. 2. Due to the difference between different monitors and lighting effects, the actual color of the item may be slightly different from the color shown on the picture.",14.0,https://cdn.shopify.com/s/files/1/0914/7816/3826/files/53060ce2ee9b48d8a343daf1b227e776.webp?v=1748110264,Other,sexy-underwear-women-gather-no-steel-ring-lingerie-bra-tube-top-wrapped-chest-beauty-back-actival-cotton-thin-section-tube-top,coffee
3PCS/Set Women Sexy Lace Panties Cotton Seamless Brazilian Panties Female Sexy Low Rise Soft Underwear G-String Lingerie S-XL,"√ About Product： These panties are made of the highest quality Nylon 75% +Spandex 25%, comfortable, breathable, and highly elastic for most people. V-waist design is more personal and human aesthetics, making these panties suitable for all body types. √ About Occasion: The classic stripes and solid color design make these panties not easily outdated. On Christmas, Birthday, Thanksgiving, New Year, Mother's Day and Valentine's Day! √ About Maintenance: This underwear can be washed by hand or in a washing machine. When washing by hand, soak and wash in warm water of about 30 degrees, be careful not to soak for too long. Model Show 1.We will ship all orders within 48 hours,all goods in our shop are free shipping by post air mail. 2.The delivery time due to the local customs,some strict country will delay several days. 3.If you do not receieve the order during the delivery date,please do not open the dispute first, please do not hesiate to contact us.we will be responsible for your parpel and try our best to solve the problem for you!!! Thanks for your understanding in advance.",16.0,https://cdn.shopify.com/s/files/1/0914/7816/3826/files/6a0ab4b1161a44f2b3762eca84199e96.webp?v=1748109316,Other,3pcs-set-women-sexy-lace-panties-cotton-seamless-brazilian-panties-female-sexy-low-rise-soft-underwear-g-string-lingerie-s-xl,Set 12
L-6L Women Large Bra Push Up Ice Silk Seamless upper Bralette Lace Wireless Summer Bras Plus Size Top Lingerie Underwear 15019,,19.0,https://cdn.shopify.com/s/files/1/0914/7816/3826/files/b6812cff651344d9ab90ec93851fc08a.webp?v=1748109307,Other,l-6l-women-large-bra-push-up-ice-silk-seamless-upper-bralette-lace-wireless-summer-bras-plus-size-top-lingerie-underwear-15019,5XL
Mesh Flower Wireless Deep V Bra Close-fitting Shockproof Brassiere for Women Large Size Lingerie Push Up Underwear Ladies,"Item: Bra Size: L, 2L, 3L, 4L Gender: Girl,Women Color: Black, Nude, Green, Blue Material: Nylon,Polyester Season: Spring,Summer,Autumn,Winter Package included: 1pc Bra
Size information: Size L: Fit for Weight: 37.5-47.5 kg; Size 2L: Fit for Weight: 47.5-57.5 kg; Size 3L: Fit for Weight: 57.5-67.5 kg; Size 4L: Fit for Weight: 67.5-77.5 kg; Please Note: 1. Manual measuring. Please allow 1-3cm error, thank you 2. Differences in color may be caused by some other reasons such as color reflection in the monitor, lighting, background etc. Please understand",18.0,https://cdn.shopify.com/s/files/1/0914/7816/3826/files/4a2264d473244fcbab6bddcc287b06e6.webp?v=1748109302,Other,mesh-flower-wireless-deep-v-bra-close-fitting-shockproof-brassiere-for-women-large-size-lingerie-push-up-underwear-ladies,Blue-2L
Women's Small Chest Underwear Gathered Breast Thickening Show Large Front Buckle Removable Strap Lingerie For Women,"Women's Small Chest Underwear Gathered Breast Thickening Show Large Front Buckle Removable Strap Lingerie For Women Function: Gather, No Trace, Breathable, Upper Support Main Fabric Composition: Nylon Style: Breast Type Mold Cup Type: Mold Cup Shoulder Strap Type: Detachable Double Shoulder Strap Breasted Type: After Four Rows Of Buckle Color: Beige, Skin Color, Black, Coffee Size: S [for 32/70ABC], M [for 34/75ABC], L [for 36/80ABC], XL [for 38/85ABC]] Features: 1. Peace Of Mind Environmental Protection Printing And Dyeing, Let You Wear Rest Assured 2. Widen Traceless Side Ratio, Strong Wrapping Force 3. Experience The Feeling Of Lightness And Nakedness, Lightness And No Weight-bearing Feeling When Wearing It. 4. There Is A Shaped Support Body, Which Can Be Supported Stably And Upward. 5. One-piece Soft And Smooth, Always Light And Upward Package Included: 1 *(1 Bra)",41.0,https://cdn.shopify.com/s/files/1/0914/7816/3826/files/86a4431800a44a238a4bbd078cd80e3f.webp?v=1748109283,Other,women-s-small-chest-underwear-gathered-breast-thickening-show-large-front-buckle-removable-strap-lingerie-for-women,34 75AB
Women Pajama Suit Fashion V-Neck Stretch Satin Babydoll Lace Sexy Lingerie Bowknot Pyjamas Sleep Shorts Set Sleepwear New,,20.0,https://cdn.shopify.com/s/files/1/0914/7816/3826/files/ab1ee8493b684e1b94f16cb699d53730.webp?v=1748109275,Other,women-pajama-suit-fashion-v-neck-stretch-satin-babydoll-lace-sexy-lingerie-bowknot-pyjamas-sleep-shorts-set-sleepwear-new,Blue
Sexy Sleepwear Women Lace Silk Satin V-Neck Nightgown Split Hem Soft Lingerie Night Dress Sleeveless Sleepwear Female Clothes,,26.0,https://cdn.shopify.com/s/files/1/0914/7816/3826/files/c7260c8a78a34545a5d1b070dd74ba28.webp?v=1748109267,Other,sexy-sleepwear-women-lace-silk-satin-v-neck-nightgown-split-hem-soft-lingerie-night-dress-sleeveless-sleepwear-female-clothes,black
5PCS/Set Women Lace Seamless Cotton Panties Sexy Brazilian Pants Ribbed Breathable Girls Underwear Soft Plus Size Lingerie S-XL,,19.0,https://cdn.shopify.com/s/files/1/0914/7816/3826/files/9126c74d73b342a486e29273a2877631.webp?v=1748109257,Other,5pcs-set-women-lace-seamless-cotton-panties-sexy-brazilian-pants-ribbed-breathable-girls-underwear-soft-plus-size-lingerie-s-xl,Set 2
Women Pajama Suit Fashion V-Neck Stretch Satin Babydoll Lace Sexy Lingerie Bowknot Pyjamas Sleep Shorts Set Sleepwear New,,20.0,https://cdn.shopify.com/s/files/1/0914/7816/3826/files/3ae22ea53757475bb6694d8a91a85373.webp?v=1748109250,Other,women-pajama-suit-fashion-v-neck-stretch-satin-babydoll-lace-sexy-lingerie-bowknot-pyjamas-sleep-shorts-set-sleepwear-new,ZY06
4Pcs Women's Panties Exquisite Lace Underwear Silk Satin Sexy Seamless Girls Lingerie Female Briefs Plus Size Comfort Underpants,,30.0,https://cdn.shopify.com/s/files/1/0914/7816/3826/files/b4e742db00514fb8a2cc2ca400236133.webp?v=1748109245,Other,4pcs-women-s-panties-exquisite-lace-underwear-silk-satin-sexy-seamless-girls-lingerie-female-briefs-plus-size-comfort-underpants,Random
CINOON Sexy Six Colors Lace Pantyhose Women Sexy Lingerie Ladies Fashion High Stocking Hosiery Exotic Nightclubs Products,"Please note: Includes: 1 pair of stockings Or 3 pairs of stockings Stocking length ：71cm Please refer to the weight for the specific size, maybe the stockings will be thin, because the diameter of the stockings is the normal size, please know before buying One Size: weight suitable for 40KG-65KG",13.0,https://cdn.shopify.com/s/files/1/0914/7816/3826/files/a6e86d1216c94e5d98d58b0a332f7109.webp?v=1748109240,Other,cinoon-sexy-six-colors-lace-pantyhose-women-sexy-lingerie-ladies-fashion-high-stocking-hosiery-exotic-nightclubs-products,Black
Sexy Women's Long Fishnet Body Stockings Fish Net Pantyhose Mesh Nylon Tights Lingerie Black Summer Thigh High Waist Hosiery,"Specification: 1.Due to the different monitors, it may cause a little color error, hope you can understand 2. Due to the different measurement methods, there will be an error of 1-3cm，hope you can understand",11.0,https://cdn.shopify.com/s/files/1/0914/7816/3826/files/342476c759db4a249d28ab78d9535b22.webp?v=1748109236,Wellness,sexy-women-s-long-fishnet-body-stockings-fish-net-pantyhose-mesh-nylon-tights-lingerie-black-summer-thigh-high-waist-hosiery,black large mesh
Women Post-Surgery Shaper Front Closure Bra Compression Posture Corrector Crop Top With Breast Support Band NEW,"100% Brand New Unit:1 piece Material:Polyester About Size: Size S:Upper Bust:70cm,Lower Bust:66cm, Size M:Upper Bust:74cm,Lower Bust:70cm, Size L:Upper Bust:78cm,Lower Bust:74cm, Size XL:Upper Bust:82cm,Lower Bust:78cm, Size 2XL:Upper Bust:86cm,Lower Bust:82cm, Specifics: 1cm=0.393inch, 1inch= 2.54cm About color： As youl know, the different computers display colors differently,  the color of the actual item may vary slightly from the following images. About size: 1. Please check the size chart carefully before you buy the item, if you don't know how to choose size, please contact our customer service 2. Please allow 2-3cm differences due to manual measurement. (1cm=0.39inch, 1 inch=2.54cm) 3. Choose the larger size if your size between two sizes.",20.0,https://cdn.shopify.com/s/files/1/0914/7816/3826/files/8d6820bbd4db4c2ba8d42b7c39f60067.webp?v=1748109204,Other,women-post-surgery-shaper-front-closure-bra-compression-posture-corrector-crop-top-with-breast-support-band-new,M
Front Closure Bralette Fallsweet Plus Size Bras For Women Underwear Seamless Sports Bra Cross Back Push up Lingerie  S-5XL,"Specifiction: Size : S M L XL 2XL 3XL 4XL 5XL Note: Due to the different measurement methods, the product and the physical existence of 1-3cm error. Please choose carefully!",22.0,https://cdn.shopify.com/s/files/1/0914/7816/3826/files/1350eca348d94a92bcceefa675f4c760.webp?v=1748109198,Other,front-closure-bralette-fallsweet-plus-size-bras-for-women-underwear-seamless-sports-bra-cross-back-push-up-lingerie-s-5xl,beige
3Pcs Ribbed Cotton Thong Panties Women's Sexy Low Rise G-String Lingerie Cute Bow Underwear Set Breathable Comfort Solid Color,,19.0,https://cdn.shopify.com/s/files/1/0914/7816/3826/files/4e5c60d9ab0a454685a800df8582b354.webp?v=1748109195,Other,3pcs-ribbed-cotton-thong-panties-women-s-sexy-low-rise-g-string-lingerie-cute-bow-underwear-set-breathable-comfort-solid-color,1
Sexy Lingerie Women Sleep Wear Camisole Bow Shorts V-Neck Tops Velvet Pajamas Sleepwear пижама женская Hot,,27.0,https://cdn.shopify.com/s/files/1/0914/7816/3826/files/6e1350b070d147bda84ecae7770d14b3.webp?v=1748109190,Other,sexy-lingerie-women-sleep-wear-camisole-bow-shorts-v-neck-tops-velvet-pajamas-sleepwear-pizhama-zhenskaia-hot,wine red
Sexy Lingerie Fancy Lace Eroticу Set Woman 2 Pieces Transparent Women's Underwear Embroidery Erotic Beautiful Bra And Panty Sets,,19.0,https://cdn.shopify.com/s/files/1/0914/7816/3826/files/361dcf6bb5604cb1b29e44024054a313.webp?v=1748109178,Other,sexy-lingerie-fancy-lace-eroticu-set-woman-2-pieces-transparent-women-s-underwear-embroidery-erotic-beautiful-bra-and-panty-sets,Black
Strawberry Cute Japanese Milk Silk Bra & Panties Set Wirefree Soft Underwear Set Kawaii Lolita Bra and Panty Set Pink Lingerie,"Description: Material:Polyester Pattern:printing Colour:White，Pink、 Size：M,L Package includes: underwear+underpants Washing method: hand wash in cold water, do not scald, machine wash, dry cleaning, bleaching, exposure, hang to dry Note: The color may be a little different due to the effect of light and moniter setting.Manual measurement, there are 2-3 mm in error, please understand.",28.0,https://cdn.shopify.com/s/files/1/0914/7816/3826/files/a39f7b60fc5143b7ad54911502ad6623.webp?v=1748109174,Other,strawberry-cute-japanese-milk-silk-bra-panties-set-wirefree-soft-underwear-set-kawaii-lolita-bra-and-panty-set-pink-lingerie,Style-D
80 silk 20 cotton thermal underwear sets for women lingerie set inner wear clothes womens winter clothing base layer pajama warm,"SOLLOS ---Wool and Silk major Silk - tank, cami, shirt, dress, pullover, sets Wool - leggings, pants, long johns, thermal sets Specification:     Green colour all not availble, if you order green we will send black. Material: 80% silk 20% cotton thin Colour: white black gray fresh red green pink Quantity: 1 set only Notice: Neutral detergent is recommended;",101.0,https://cdn.shopify.com/s/files/1/0914/7816/3826/files/fbb9e71c685a4142b0b69007f17d10f5.webp?v=1748109168,Other,80-silk-20-cotton-thermal-underwear-sets-for-women-lingerie-set-inner-wear-clothes-womens-winter-clothing-base-layer-pajama-warm,red
3 Pcs/set Hot Sale Fashion Webbing Bra Buckles Shadow-Shaped Underwear Fasteners Bra Clips Strap Holders Invisible Buckle,,10.0,https://cdn.shopify.com/s/files/1/0914/7816/3826/files/a009e7f7e06b4d8a993c4ee97833bba1.webp?v=1748109163,Other,3-pcs-set-hot-sale-fashion-webbing-bra-buckles-shadow-shaped-underwear-fasteners-bra-clips-strap-holders-invisible-buckle,style 2 group 2
4PCS Sexy WOMEN'S Cotton Thong Underwear for Europe and the United States 22 to 34 Inch Waist Women,,17.0,https://cdn.shopify.com/s/files/1/0914/7816/3826/files/86854b4f4624493dbcd23443287acb21.webp?v=1748109159,Wellness,4pcs-sexy-women-s-cotton-thong-underwear-for-europe-and-the-united-states-22-to-34-inch-waist-women,4PCS
3PCs Women's panties Sexy seamless thong sport breathable elastic T panties women leopard print,"Size Chart Size measured by ourselves,sometimes has some errors, but always within 1-3cm.",19.0,https://cdn.shopify.com/s/files/1/0914/7816/3826/files/9954a44aae7d46ce9768083087fbebd9.webp?v=1748109156,Other,3pcs-women-s-panties-sexy-seamless-thong-sport-breathable-elastic-t-panties-women-leopard-print,B
